,title,content,link,image,video,category
303,Qatar World Cup critic has been sentenced to three years in jail without a single piece of evidence shown in court. The defendant was not allowed to participate in his own trial either.,,https://www.nrk.no/sport/qatar-kritiker-domt-til-tre-ar-i-fengsel_-1.15772690,False,False,sports
304,12-year-old Ukrainian refugee from Mariupol scores goal in Shakhtar Donetsk charity match,,https://www.cnn.com/2022/04/15/football/dmytro-keda-shakhtar-donetsk-ukraine-war-spt-intl/index.html,False,False,sports
305,"After Ryan Tannehill's pass deflects off of Micah Hyde's helmet, Tennessee Titans receiver Julio Jones makes the catch off the ricochet while managing to stay inbounds",,,False,True,sports
306,Footvolley is a sport which combines aspects of beach volleyball and association football. Footvolley was created by Octavio de Moraes in 1965 in Brazil,,https://i.imgur.com/NgmtYMP.gifv,False,False,sports
307,Red Sox catcher Christian Vazquez hits a walk-off home run in Game 3 of the ALDS,,,False,True,sports
308,Casper Ruud pocketing Zverev's shot.,,,False,True,sports
309,University of Tennessee runningback Jaylen Wright is controversially called short of the goal-line in overtime vs Purdue in the Music City Bowl. Purdue would go onto win the game 48–45.,,,False,True,sports
310,Sebastian Vettel says climate change makes him question his Formula 1 job,,https://edition.cnn.com/2022/05/13/motorsport/sebastian-vettel-climate-change-f1-spt-intl/index.html,False,False,sports
311,Derrick Henry’s impressive 76 yd TD against the Buffalo Bills,,,False,True,sports
312,Conor McGregor throws terrible first pitch ahead of Chicago Cubs game,,https://www.nbcnews.com/news/us-news/conor-mcgregor-throws-terrible-first-pitch-ahead-chicago-cubs-game-n1279859,False,False,sports
313,"Karsten Warholm breaks 400m hurdles world record, one of the longest-standing world records in T&F",,https://olympics.nbcsports.com/2021/07/01/karsten-warholm-world-record-400-hurdles/,False,False,sports
314,Canada tops Sweden in unforgettable Olympic soccer gold medal shootout,,https://dailyhive.com/vancouver/canada-sweden-olympic-soccer-gold-medal-match,False,False,sports
315,F1 rookie Zhou saves his car in Monaco,,,False,True,sports
316,United States men's basketball loses second straight exhibition to Australia,,https://theathletic.com/news/united-states-mens-basketball-loses-second-straight-exhibition-to-australia/0QzC4iA4rcWI?source=twitterhq,False,False,sports
317,"No vaccine, no French Open for Novak Djokovic, says France Sports Ministry",,https://timesofindia.indiatimes.com/sports/tennis/top-stories/no-vaccine-no-french-open-for-novak-djokovic-says-france-sports-ministry/articleshow/88950462.cms,False,False,sports
318,"Norwich City supporters chant ""USA! USA! USA!"" after Josh Sargent scores two goals vs Watford",,,False,True,sports
319,Patriots Release Cam Newton,,https://boston.cbslocal.com/2021/08/31/patriots-release-cam-newton/,False,False,sports
320,Patrick Mahomes stops celebration to pay respects to Josh Allen after AFC divisional game,,,False,True,sports
321,Putin suspended as honorary president of International Judo Federation,,https://www.reuters.com/lifestyle/sports/putin-suspended-honorary-president-international-judo-federation-2022-02-27/,False,False,sports
322,Ukraine's Mahuchikh wins emotional gold at the World Indoor Championships,,https://www.bbc.co.uk/sport/athletics/60806121,False,False,sports
323,Sam Kerr (Chelsea W) outrageous volley against Manchester United,,,False,True,sports
324,Tokyo's surging COVID-19 cases likely means new state of emergency through Olympics,,https://www.espn.com/olympics/story/_/id/31776079/tokyo-surging-covid-19-cases-likely-means-new-state-emergency-olympics,False,False,sports
325,Jake Daniels: Blackpool forward becomes UK's first active male professional footballer to come out publicly as gay,,https://www.skysports.com/football/news/11095/12614531/jake-daniels-blackpool-forward-becomes-uks-first-active-male-professional-footballer-to-come-out-publicly-as-gay,False,False,sports
326,Giannis with the alley-oop to himself,,,False,True,sports
327,DeAndre Ayton dunks it in at the buzzer to make it 2-0 Suns,,,False,True,sports
328,"Sabrina Ionescu makes a basket, then hustles back for a defensive stop",,,False,False,sports
329,Cristiano Ronaldo scores again from penalty against Brentford.,,,False,True,sports
330,Dylan Alcott celebrates his US Open victory by downing a beer from his trophy,,,False,True,sports
331,England beat Denmark to end 55-year wait and set up Euro 2020 final vs Italy,,https://www.mirror.co.uk/sport/football/news/breaking-england-denmark-euro2020-final-24481483,False,False,sports
332,"LeBron, Stewart ejected after LeBron elbows Stewart in face",,https://www.espn.com/video/clip/_/id/32685878,False,False,sports
333,Russia loses bid to freeze ban from World Cup qualifying,,https://apnews.com/article/russia-ukraine-sports-soccer-fifa-court-of-arbitration-for-sport-a213c4e66aea09032a18d6ba2739e258,False,False,sports
334,"Ohio quarterback Armani Rogers runs for an NCAA record-tying 99-yard touchdown, becoming just the second quarterback to ever have a 99-yard touchdown run",,,False,True,sports
335,WTA chairman willing to pull out of China if tennis star Peng Shuai not fully accounted for,,https://edition.cnn.com/2021/11/18/china/wta-ceo-peng-shuai-steve-simon-intl-hnk/index.html,False,False,sports
336,Second goal scored by Ukraine last night came following 1:46 of uninterrupted possession and 24 straight completed passes. Special goal by a team in which 6 players on the pitch haven’t played a competitive match in 6 months.,,,False,True,sports
337,Mexican Women’s League - Goalkeeper suffers ACL tear and opponents take advantage to score a goal,,,False,True,sports
338,Golden State Warriors player Andrew Wiggins receives COVID-19 vaccine after NBA denied religious exemption,,https://www.cbsnews.com/news/andrew-wiggins-receives-covid-19-vaccine-golden-state-warriors/,False,False,sports
339,"Emma Mckeon finishes with 7 medals, equalling the most medals for a woman in a single Olympics",,https://www.abc.net.au/news/2021-08-01/emma-mckeon-50m-freestyle-tokyo-olympics-gold-record/100340874,False,False,sports
340,Mohamed Salah scores a brilliant goal vs Manchester City ( [2] - 1 ),,,False,True,sports
341,Anderson Silva uses Muhammad Ali’s ‘Phantom Punch’,,,False,False,sports
342,Thiago's Insane Champion’s League Goal Shot Trajectory,,,False,True,sports
343,"Inter Milan's second choice goalkeeper, Ionuț Radu drops a massive clanger that's likely to cost them the Serie A title as Inter go on to lose 2-1 to Bolonga.",,,False,True,sports
344,"Lance ‘Buddy’ Franklin becomes just the 6th Australian Rules player ever to kick 1,000 goals",,https://twitter.com/AFL/status/1507317489226506241,False,False,sports
345,Ja Morant with a buzzer beater for the Grizzlies against the Spurs,,,False,True,sports
346,WTA Chairman expresses concerns over missing Chinese tennis player Peng Shuai after she made sexual assault allegations against a Chinese government official two weeks ago,,https://www.wtatennis.com/news/2356029/statement-by-steve-simon-wta-chairman-ceo,False,False,sports
347,"Carl Nassib, an edge rusher for the Raiders and the first openly gay player on an active roster, strip sacks Lamar Jackson in overtime",,,False,True,sports
348,‘WhistleGate': Sox Fans Accuse Astros of Cheating in Game 5,,https://www.nbcboston.com/news/sports/sox-fans-accuse-astros-of-cheating-in-whistlegate-scandal/2531295/,False,False,sports
349,"Washington State receiver Calvin Jackson Jr. makes a one-handed catch in while in midair, gets a foot down in the endzone and maintain controls of it to score the touchdown",,,False,True,sports
350,7 time F1 world champion Lewis Hamilton extends his stay at Mercedes for 2 years.,,https://www.formula1.com/en/latest/article.breaking-hamilton-agrees-new-two-year-contract-with-mercedes.5XURLL7ShyqezkYgf9eztg.html,False,False,sports
351,Rafael Nadal pulls out of Wimbledon and Tokyo Olympics,,https://www.cnn.com/2021/06/17/tennis/rafael-nadal-withdraws-from-wimbledon-and-tokyo-spt-intl/index.html,False,False,sports
352,Cristiano Ronaldo scores in his first Champions League game since rejoining Manchester United,,,False,True,sports
353,A time-lapse of the Madison Square Garden getting set up for Ali-Frazier I.,,,False,True,sports
354,Michigan head coach Juwan Howard hugs an emotional Tennessee player after Michigan's upset over UT in the NCAA tournament,,https://gfycat.com/basiclazyantelope,False,False,sports
355,North Korea airs first Olympics footage two days after closing ceremony,,https://www.independent.co.uk/asia/north-korea-airs-olympics-coverage-b1901951.html,False,False,sports
356,"Former Jets, Rams RB Zac Stacy has been arrested after the shocking video showing him beating his ex-girlfriend in front of their son. He's facing charges of aggravated battery and criminal mischief.",,https://twitter.com/NFL_DovKleiman/status/1461681078155071493?t=_TO_177sNhnfro01cTdTgA&s=19,False,False,sports
357,Every member of the Phoenix Suns' offense touches the ball on a possession capped with an and-1 layup by Deandre Ayton,,,False,True,sports
358,"Ole Miss star QB Matt Corral, one of the top quarterback prospects in the upcoming NFL draft, declined to opt-out of the Sugar Bowl against Baylor. During the Sugar Bowl, Corral suffered a lower leg injury that would take him out of the game and put him in crutches.",,,False,True,sports
359,'This is who I am': Predators prospect Luke Prokop comes out,,https://theathletic.com/2711747/2021/07/19/luke-prokop,False,False,sports
360,"Major League Baseball asks team to stop testing players, ""just treat symptoms"" of Covid 19, according to Boston Red Sox' Hunter Renfroe",,https://twitter.com/MerloniFauria/status/1436050515025088513?s=19,False,False,sports
361,Tony Hawk Suffers Severe Broken Leg In Skating Accident,,https://www.tmz.com/2022/03/08/tony-hawk-suffers-severe-broken-leg-skating-accident/,False,False,sports
362,Russian karter faces FIA investigation over alleged N*zi salute,,https://www.motorsport.com/kart/news/russian-karter-faces-fia-investigation-over-alleged-nazi-salute/9808631/,False,False,sports
363,USA Fencing Is Blocking A Top Athlete From A Competition After Sexual Assault Accusations. It Took Eight Years And Widespread Outcry.,,https://www.buzzfeednews.com/article/briannasacks/usa-fencing-hadzic-competition-safesport,False,False,sports
364,Texas A&M unable to play in Gator Bowl due to COVID-19,,https://sports.yahoo.com/report-texas-am-unable-to-play-in-gator-bowl-due-to-covid-19-181502262.html,False,False,sports
365,"After being dominated the entire fight, Sergio Pettis lands a spinning back fist in round four that knocks out Kyoji Horiguchi.",,,False,True,sports
366,"Coach Sean Payton leaving the Saints, plans to retire",,https://www.wbrz.com/news/report-saints-coach-sean-payton-is-retiring/,False,False,sports
367,Olympic champion Evgeny Rylov loses Speedo deal after attending Putin rally,,https://www.cnn.com/2022/03/22/sport/evgeny-rylov-speedo-russia-ukraine-spt-intl/index.html,False,False,sports
368,Norwegian Ski Federation Does Not Want Russian Athletes Participating In Their Competitions,,https://www.skiforbundet.no/norges-skiforbund/nyheter/2022/2/nei-til-russiske-utovere-i-konkurranser-i-norge/,False,False,sports
369,The wife of Arizona Diamondbacks pitcher Zach Davies has filed for divorce. She claims that he completely ghosted her out of the blue and has not spoken to her in a year.,,https://www.knbr.com/2022/05/18/diamondbacks-pitchers-estranged-wife-says-he-ghosted-her-for-a-year/,False,False,sports
370,Trae Young shake n bakes Jrue Holiday and then shimmys before hitting a dagger.,,https://gfycat.com/testybluealleycat,False,False,sports
371,"Djokovic is a profile in selfishness, and sports leaders are failing us all",,https://www.espn.com/tennis/story/_/id/33050352/novak-djokovic-profile-selfishness-sports-leaders-failing-us-all,False,False,sports
372,"Kyle Schwarber hits a grand slam to give the Red Sox a 6–0 lead in Game 3 of the ALCS, the third Red Sox grand slam in the series (a record)",,,False,True,sports
373,A message from Christian Eriksen,,https://twitter.com/DBUfodbold/status/1404695288401514497,False,False,sports
374,World Cup 2022: Female referees to officiate for first time,,https://www.independent.co.uk/sport/football/world-cup-2022-female-referees-qatar-b2082760.html,False,False,sports
375,"Jon Gruden Sues NFL & Roger Goodell, You Destroyed My Career",,https://www.tmz.com/2021/11/12/jon-gruden-lawsuit-las-vegas-raiders-nfl-roger-goodell/,False,False,sports
376,U.S. Senate pledges diplomatic boycott of Beijing Olympics,,https://www.yahoo.com/sports/olympics-boycott-china-diplomatic-united-states-senate-bill-164328654.html,False,False,sports
377,Friends who have attended every Super Bowl plan final trip,,https://apnews.com/article/9ddb646ad3e490458b0d04ee84742101,False,False,sports
378,Rougned Odor's home run negated after calling timeout,,,False,True,sports
379,Derek Poundstone loses the 2008 World's Strongest Man contest to Mariusz Pudzianowski at the very last moment,,,False,True,sports
380,Phoenix Suns fans shell shocked in Game 7,,,False,True,sports
381,Raiders release CB Damon Arnette after social media video leaks allegedly showing him holding gun and making death threats,,https://sports.yahoo.com/raiders-release-cb-damon-arnette-after-social-media-video-leaks-allegedly-showing-him-holding-gun-and-making-death-threats-192509055.html,False,False,sports
382,Max Verstappen wins the 2021 World's Driver Championship,,https://www.espn.co.uk/f1/race/_/id/600001776,False,False,sports
383,Gerwyn Price Lands A 9 Darter at the World Darts Championships!!,,,False,True,sports
384,Deyverson trying to fake a foul comming from the ref in the Libertadores final.,,,False,True,sports
385,Seth Beer of the Arizona Diamondbacks hits a game-winning home run on National Beer Day,,,False,True,sports
386,[Fox Sports] ‘Possibly fake’ high school Bishop Sycamore ‘duped ESPN’ into airing football game,,https://www.foxsports.com.au/nfl/possibly-fake-high-school-bishop-sycamore-duped-espn-into-airing-football-game/news-story/87a9e1d5d77ef905af377b56670e6c98,False,False,sports
387,Josh Allen becomes the first player in NFL history to record a sack against a quarterback with the exact same name.,,,False,True,sports
388,Ibrahimovic stops tying his shoes and scores the goal against Lazio,,,False,True,sports
389,Yanks vs Orioles 9/15/21 Ump throws Ground Crew out of the game,,,False,True,sports
390,Latvia's Aivars Smaukstelis takes first place in The Power Stairs during the 2022 Europe's Strongest Man contest,,,False,True,sports
391,94th minute absolute worldie from Morecambe’s Carl Stockton to win them the game at Fleetwood at the weekend,,,False,True,sports
392,"Lachlan Morton completes 5,510km Alt Tour (unsupported Tour de France), beating peloton to Paris by five days.",,https://www.bikeradar.com/news/lachlan-morton-completes-alt-tour/,False,False,sports
393,Benzema cold-blooded penalty CL semifinal,,,False,True,sports
394,Machida showing respect and sportsmanship after a brutal kick.,,,False,True,sports
395,"Chiefs threaten to move across state line to Kansas, we are officially entering a new golden age of NFL stadium giveaway demands",,https://www.fieldofschemes.com/2022/03/30/18645/chiefs-threaten-to-move-across-state-line-to-kansas-we-are-officially-entering-a-new-golden-age-of-nfl-stadium-giveaway-demands/,False,False,sports
396,"John Clayton, longtime NFL reporter and radio host, dies at 67",,https://www.espn.com/nfl/story/_/id/33541834/long-nfl-reporter-john-clayton-dies-67,False,False,sports
397,"For China's Uyghurs, ""the genocide doesn't stop"" for the Olympics",,https://www.yahoo.com/news/chinas-uyghurs-genocide-doesnt-stop-123504373.html,False,False,sports
398,"With 800m to go in the men's team pursuit gold medal race, both teams perform their final position change and it's a head to head duel between Denmark's Frederik Rodenberg and Italy's Filippo Ganna",,,False,True,sports
399,"31 years ago today, Michael Jordan and the Bulls lost their 3rd consecutive game to Celtics. Jordan never lost 3 games in a row again on the Bulls.",,https://www.basketball-reference.com/boxscores/199011060CHI.html,False,False,sports
400,United States named host nation for 2031 and 2033 Rugby World Cup,,https://usabid.rugby/news/united-states-named-host-nation-for-2031-and-2033-rugby-world-cup,False,False,sports
401,"Mbappé, Messi & Neymar: last three penalties for PSG",,,False,False,sports
402,Texas Tech kicker Jonathan Garibay drills a 62-yard field goal to upset Iowa State with no time left,,,False,True,sports
403,"Women's speed climbing record got smashed, in under 7 seconds",,,False,True,sports
404,"U.S. reclassifies WNBA star Brittney Griner as 'wrongfully detained' by Russia, sources say",,https://www.espn.com/wnba/story/_/id/33846524/us-reclassifies-wnba-star-brittney-griner-wrongfully-detained-russia-sources-say,False,False,sports
405,Finland wins first ice hockey Olympic gold medal after beating ROC 2-1 in the final,,https://www.iihf.com/en/events/2022/olympic-m/news/32245/fin-roc-gmg,False,False,sports
406,Matt Harvey suspended 60 games by MLB for distributing oxycodone.,,https://www.espn.com/mlb/story/_/id/33934008/matt-harvey-suspended-60-games-mlb-distributing-oxycodone,False,False,sports
407,Borré's longshot against Barcelona - UEFA Europa League,,,False,False,sports
408,Craig Noone nets an outrageous volley to earn Macarthur a late draw away to Central Coast Mariners in the A-League.,,,False,True,sports
409,Finnish National Team wearing Eriksen shirts during warmups,,,True,False,sports
410,NHL commissioner Bettman has asked to move hockey to Summer Olympics,,https://ca.sports.yahoo.com/news/nhl-gary-bettman-has-asked-to-move-hockey-summer-olympics-164521297.html,False,False,sports
411,Notre Dame safety Kyle Hamilton races across the width of the field to intercept a pass against Florida State,,https://gfycat.com/unknownunhealthyirishsetter,False,False,sports
412,Veteran RB Frank Gore says he plans to sign one-day contract with San Francisco 49ers to retire with team,,https://www.espn.com/nfl/story/_/id/33662094/veteran-rb-frank-gore-says-plans-sign-one-day-contract-san-francisco-49ers-retire-team,False,False,sports
413,Serena Williams Dominated by Elena Rybakina in French Open Fourth Round,,https://lastwordonsports.com/tennis/2021/06/06/serena-williams-dominated-elena-rybakina-french-open/,False,False,sports
414,Real Salt Lake eliminate the Seattle Sounders in PK’s after not recording a single shot the entire match,,,False,True,sports
415,Real Madrid's goal against Alcoyano,,,False,True,sports
416,"India win a historic test vs England at The Home of Cricket, Lord's.",,,False,True,sports
417,Mo Salah with a delicious finish to give Liverpool the lead against Norwich City,,,False,True,sports
418,Tiger Woods shoots 6-over in final round as he completes comeback at Masters.,,https://www.espn.com/golf/story/_/id/33713741/tiger-woods-shoots-6-final-round-completes-comeback-masters,False,False,sports
419,Diego Simeone runs off at full-time to the anger of Manchester United supporters as Atlético Madrid win 1-0 at Old Trafford,,,False,True,sports
420,Rio Olympics chief sentenced to 30 years in prison for buying 2016 votes,,https://www.theguardian.com/sport/2021/nov/26/rio-olympics-chief-sentenced-to-30-years-in-prison-for-buying-2016-votes,False,False,sports
421,Novak Djokovic calls Wimbledon ban on Russian and Belarusian players 'crazy',,https://www.cnn.com/2022/04/21/tennis/djokovic-wimbledon-tennis-russia-ban-intl-spt/index.html,False,False,sports
422,"Saints attempted to sign Drew Brees, Philip Rivers to emergency deal ahead of Week 16, per report",,https://www.cbssports.com/nfl/news/saints-attempted-to-sign-drew-brees-philip-rivers-to-emergency-deal-ahead-of-week-16-per-report/,False,False,sports
423,"Canada announces diplomatic boycott of Beijing Olympics, athletes will still compete",,https://beta.ctvnews.ca/national/politics/2021/12/8/1_5698625.html,False,False,sports
424,Wilder-Fury III finish,,https://gfycat.com/demandingunpleasantburro,False,False,sports
425,Former Dallas Cowboys RB Marion Barber found dead. He was 38,,https://www.star-telegram.com/sports/nfl/dallas-cowboys/article262044907.html,False,False,sports
426,Novak Djokovic needs to prove vaccine exemption ahead of Australian Open or go home - Australian PM.,,https://www.espn.co.uk/tennis/story/_/id/32997513/novak-djokovic-needs-prove-exemption-go-home-australian-pm,False,False,sports
427,Paris wants to make swimming in the Seine safe - and legal - for everyone,,https://www.smh.com.au/world/europe/paris-wants-to-make-swimming-in-the-seine-safe-and-legal-for-everyone-20211230-p59ks6.html,False,False,sports
428,Griner's detention in Russia extended to May 19,,https://www.espn.com/wnba/story/_/id/33525694/wnba-star-brittney-griner-detention-russia-extended-19,False,False,sports
429,James Hickey (44) of Ireland sets a new Masters World Record in the deadlift with a pull of 969lbs / 440kg. This event took place in Ireland 2 days ago.,,,False,True,sports
430,Joe Root cops a blow to his groin while facing Mitchell Starc. Ashes 2021-2022.,,,False,True,sports
431,The NFL Had a Ban on Black Players. Why Don’t We Remember the Man Who Broke It?,,https://slate.com/culture/2021/12/kenny-washington-nfl-color-barrier-rams-jackie-robinson-football-history.html?via=rss,False,False,sports
432,‘There cannot be two Cleveland Guardians teams in Cleveland’: Roller derby team sues baseball franchise,,https://fox8.com/sports/there-cannot-be-two-cleveland-guardians-teams-in-cleveland-roller-derby-team-sues-baseball-franchise/,False,False,sports
433,Novak Djokovic denied entry to Australia after visa mix-up,,https://www.thetimes.co.uk/article/novak-djokovic-granted-medical-exemption-to-play-in-australian-open-dx6gss525?utm_medium=Social&utm_source=Twitter#Echobox=1641393397,False,False,sports
434,Canada Beat USA to win women's hockey gold medal with 3-2 win,,https://lastwordonsports.com/hockey/2022/02/17/canada-beats-usa-to-win-2022-womens-olympic-hockey-gold/,False,False,sports
435,Biles and Her Teammates Rip the F.B.I. for Botching Nassar Abuse Case,,https://www.nytimes.com/2021/09/15/sports/olympics/fbi-hearing-larry-nassar-biles-maroney.html,False,False,sports
436,NFL Funds Marijuana Research As Federal Prohibition ‘Adversely’ Impacts Studies Into Opioid Alternative For Players,,https://www.marijuanamoment.net/nfl-funds-marijuana-research-saying-federal-prohibition-adversely-impacts-studies-into-opioid-alternative-for-players/,False,False,sports
437,Tatis Jr double jumps to make the catch,,https://streamable.com/7d06t3,False,False,sports
438,Flying knee from own teammate collects Tim English in the jaw.,,,False,True,sports
439,[Shams] Team USA loss to France today is USAB’s first Olympic loss since 2004 vs. Argentina.,,https://twitter.com/ShamsCharania/status/1419297004694425605?s=09,False,False,sports
440,"God, it's brutal out here: Djokovic says weather conditions in Tokyo are 'very tough'",,https://www.cnn.com/world/live-news/tokyo-2020-olympics-07-24-21-spt/h_3436d86063a1504478e51ccc10cfebec,False,False,sports
441,Mondo Duplantis's clearance of 18ft (5.50m) at Tokyo Qualifying is a sight to behold,,,False,True,sports
442,6 Players Lose Sight of the Puck,,,False,True,sports
443,"Utah, already up 21 points over #3 Oregon, called a timeout to give punt returner Britain Covey a return opportunity before the first half expired; Covey responded with a 78-yard, touchdown-scoring return to put Utah up four scores at halftime.",,,False,True,sports
444,Benzema penalty against City.Cl semifinal 2022,,,False,True,sports
445,"Willie O’Ree, the National Hockey League’s 1st Black Player, Receives Unanimous Support from U.S. Senate for Congressional Gold Medal",,https://goodblacknews.org/2021/08/02/willie-oree-the-national-hockey-leagues-1st-black-player-receives-unanimous-support-from-u-s-senate-for-congressional-gold-medal/,False,False,sports
446,Eintracht Frankfurt defeat Rangers F.C. in Europa League Final on penalties [5:4] to win first international trophy in 42 years,,,False,True,sports
447,"Randy Johnson hits a bird with a pitch on March 24, 2001, during a spring training game.",,,False,True,sports
448,Embiid hits the triple with 0.7s remaining to put the Sixers up 3,,,False,True,sports
449,"Canada qualify for the 2022 FIFA World Cup, their first since 1986",,https://twitter.com/CanadaSoccerEN/status/1508200731421163520,False,False,sports
450,The 2012 Olympic Gold Medal USA Basketball Team,,,False,True,sports
451,"Possibly fake high school, Bishop Sycamore, accused of stiffing Canton OH hotel after recent controversy with televised ESPN game",,https://www.cantonrep.com/story/news/2021/09/01/bishop-sycamore-football-team-accused-stiffing-canton-hotel-espn-fairfield-marriott-geico/5681745001/?utm_source=facebook&utm_medium=Social&utm_campaign=ghf-cantonrep-main&fbclid=IwAR29Pf5Yg3aXjFJb9Nie3uYpgabu9kxeoJtDN85zb7JzbyHDk1fPXn9cqmY,False,False,sports
452,"Down 5-8 in the bottom of the 9th with bases loaded, Tennessee outfielder Drew Gilbert fulfills the most coveted backyard fantasy by hitting a walkoff home run ftw",,https://twitter.com/barstoolsports/status/1400989856046764036?s=21,False,False,sports
453,Mr.Universe 2021 in Iran,,,False,True,sports
454,Tom Brady’s best throw of the night destroys Microsoft tablet,,https://www.theverge.com/2021/12/20/22846124/tom-brady-destroy-microsoft-surface-tablet,False,False,sports
455,Chinese Embassy voices 'grave concern' over accusations of judging bias at Beijing Olympics,,http://yna.kr/AEN20220209011900325?input=red,False,False,sports
