,title,content,link,image,video,category
606,The Women's Tennis Association (WTA) announces its decision to suspend all tournaments in China,,https://www.wtatennis.com/news/2384758/steve-simon-announces-wta-s-decision-to-suspend-tournaments-in-china,False,False,sports
607,Moses kicks the game winning Conversion.,,,False,True,sports
608,Francois Steyn kicks a drop goal from 60 metres,,,False,True,sports
609,"Congress says Washington Commanders appear to have broken financial laws, owe money to visiting teams, season-ticket holders",,https://www.espn.com/nfl/story/_/id/33724271/congress-says-washington-commanders-appear-broken-financial-laws-owes-money-visiting-teams-season-ticket-holders,False,False,sports
610,Darren Helm scores with 5 seconds left to send the Colorado Avalanche to the Western Conference Finals,,,False,True,sports
611,"Los Angeles Rams left tackle Andrew Whitworth retires after 16 NFL seasons, goes out on top",,https://www.espn.com/nfl/story/_/id/33510042/los-angeles-rams-left-tackle-andrew-whitworth-retires-16-nfl-seasons,False,False,sports
612,"Notre Dame football coach Brian Kelly after Notre Dame's win over Florida State: ""You know, I'm in favor of execution. Maybe our entire team needs to be executed after tonight.""",,,False,True,sports
613,Sydney McLaughlin crushes 400m hurdles world record at Olympic Trials,,https://olympics.nbcsports.com/2021/06/28/sydney-mclaughlin-world-record-400-hurdles-olympic-trials/,False,False,sports
614,POV of Charles Leclerc's save in the wet at Imola GP free practice,,,False,False,sports
615,Army's Cole Talley kicks a game-winning field goal as time expires to defeat Missouri in the 2021 Armed Forces Bowl.,,,False,True,sports
616,Giants manager Gabe Kapler says he will skip national anthem going forward to protest US gun control,,https://www.yahoo.com/sports/giants-manager-gabe-kapler-skip-national-anthem-uvalde-shooting-230434050.html,False,False,sports
617,"Brett Favre owes Mississippi $828K and wrestlers owe $4.8M, auditor says in latest demand",,https://mississippitoday.org/2021/10/12/brett-favre-mississippi-welfare-demand-shad-white/,False,False,sports
618,Allyson Felix qualifies for fifth Olympic Games!,,https://www.usatoday.com/story/sports/olympics/2021/06/20/allyson-felix-lands-spot-2021-tokyo-olympics-team-usa/7762782002/,False,False,sports
619,Opinion: Tyson Fury's 11th-round KO of Deontay Wilder capped heavyweight title fight for the ages,,https://www.usatoday.com/story/sports/boxing/2021/10/10/tyson-fury-deontay-wilder-3-best-heavyweight-title-fight-ever/6079779001/,False,False,sports
620,Zeb Wise walks away from fiery Sprint Car crash (8-29-21),,,False,True,sports
621,Krzysztof Wierzbicki performs the heaviest deadlift ever,,,False,True,sports
622,"Retired rugby league player Kevin Sinfield just ran 101 miles in 24 hours, raising over £1m for motor neurone disease causes in honour of former Leeds Rhinos and England teammate Rob Burrow, who was diagnosed with MND in 2019",,https://twitter.com/bbcbreakfast/status/1463063255681798145?s=21,False,False,sports
623,NZ cricket team calls off Pakistan tour minutes before first game citing security concerns,,https://www.espncricinfo.com/story/pak-vs-nz-2021-new-zealand-call-off-pakistan-tour-minutes-before-first-odi-citing-security-concerns-1278280,False,False,sports
624,"The controversial conclusion to the 2021 Formula 1 championship season, as seen on Dutch TV",,,False,True,sports
625,"Sepak Takraw match between Indonesia against Malaysia in the SEA GAME 2018, a huge moment for Malaysia.",,,False,True,sports
626,Clinton Portis and two other former NFL players plead guilty in multimillion-dollar health care fraud scheme,,https://www.cnn.com/2021/09/07/us/former-nfl-players-health-care-fraud-guilty-pleas/index.html,False,False,sports
627,"Tom ""The Albatross"" Stoltman takes first place in the Log Lift Ladder",,,False,True,sports
628,Nets say Irving will not play with team until eligible as 'full participant',,https://www.sportsnet.ca/nba/article/nets-say-irving-will-not-play-team-eligible-full-participant/,False,False,sports
629,French lawmakers have proposed a Hijab Ban in competitive sports like Soccer,,,False,True,sports
630,"As Henrik Lundqvist says ""don't let that guy score,"" that guy scores.",,,False,True,sports
631,Real goal against Liverpool,,,False,True,sports
632,US Figure skater Nathan Chen wins gold with a new highest score in history!,,,True,False,sports
633,"Milwaukee Bucks beat Atlanta Hawks in Game 6, advance to NBA Finals",,https://www.upi.com/Sports_News/NBA/2021/07/03/NBA-playoffs-Milwaukee-Bucks-beat-Atlanta-Hawks-reach-NBA-Finals/4461625367728/,False,False,sports
634,"Hidilyn Diaz sets new Olympic record, wins Philippines' first-ever Olympic gold medal",,https://tv5.espn.com/story/_/id/31888290/history-hidilyn-diaz-wins-ph-first-ever-olympic-gold,False,False,sports
635,Trick play kickoff return,,https://gfycat.com/hastyinfatuatedbellsnake,False,False,sports
636,Glenn Phillips saves a boundary in a very athletic but unusual manner. New Zealand vs India. (Fielder cannot be in contact with the boundary cushion and the ball at the same time),,,False,True,sports
637,Tom Brady addresses thoughts on retirement: It 'pains' Gisele 'to see me get hit',,https://uk.sports.yahoo.com/amphtml/news/tom-brady-addresses-retirement-talk-it-pains-gisele-to-see-me-get-hit-012927325.html,False,False,sports
638,"Bucs receiver Antonio Brown obtained a fake COVID-19 vaccination card to avoid NFL protocols, according to his former live-in chef.",,https://twitter.com/TB_Times/status/1461441560663502857,False,False,sports
639,Denmark and Finland fans chant Christian Eriksen's name together after the game was suspended,,,False,True,sports
640,Brock Holt throws the slowest moving pitch to earn a strike in recorded MLB history. 31 MPH.,,https://streamable.com/bqxwlf,False,False,sports
641,Naomi Osaka secures win in first appearance after four-month break from tennis,,https://edition.cnn.com/2022/01/04/tennis/naomi-osaka-alize-cornet-melbourne-win-intl-spt/index.html?utm_source=twCNN&utm_term=link&utm_content=2022-01-04T16%3A47%3A46&utm_medium=social,False,False,sports
642,Tampa Bay OF Randy Arozarena steals homeplate against the Red Sox,,,False,True,sports
643,"Evan ""The T-Rex"" Singleton wins the 2021 Giants Live World Open contest",,,False,True,sports
644,Rio Olympics: System to manipulate outcome of boxing matches by officials in place at 2016 Games,,https://www.bbc.co.uk/sport/boxing/58747880,False,False,sports
645,"'The Iceman' Gerwyn Price hit's 2 x 9 Dart Finishes in one night, something that has only ever happened once before in 40+ years of TV History",,,False,True,sports
646,Lakers' Caruso arrested for marijuana possession,,https://www.espn.com/nba/story/_/id/31690313/los-angeles-lakers-guard-alex-caruso-arrested-texas-marijuana-possession,False,False,sports
647,Rich Strike wins 2022 Kentucky Derby as 80-1 long shot,,https://dknation.draftkings.com/2022/5/7/23061649/kentucky-derby-2022-results-purse-money-winner-rich-strike-long-shot-upset-miracle,False,False,sports
648,"Tokyo Olympics: Adopted from China, Canada’s Maggie MacNeil wins gold and Chinese social media laments its one-child policy",,https://www.scmp.com/sport/china/article/3142642/tokyo-olympics-adopted-china-canadas-maggie-macneil-wins-gold-and,False,False,sports
649,"North Carolina beats Duke in Coach K's final game, advances to NCAA title game",,https://www.sportsnet.ca/ncaa/article/north-carolina-beats-duke-in-coach-ks-final-game-advances-to-ncaa-title-game/,False,False,sports
650,James Madison University cancels softball season after star player Lauren Bernett's death,,https://www.nbcnews.com/news/us-news/james-madison-university-cancels-softball-season-star-player-lauren-be-rcna26895,False,False,sports
651,Kentucky swimmer who tied with Lia Thomas says majority of women not okay with 'trajectory' of female sports,,https://news.yahoo.com/kentucky-swimmer-tied-lia-thomas-120107873.html,False,False,sports
652,"Tampa Bay Buccaneers are ""100-percent vaccinated"" against COVID-19, head coach Bruce Arians says",,https://www.foxla.com/news/tampa-bay-buccaneers-are-100-percent-vaccinated-against-covid-19-head-coach-bruce-arians-says-report.amp?taid=613203bb05de4d0001e767ae&utm_campaign=trueanthem&utm_medium=trueanthem&utm_source=twitter&__twitter_impression=true,False,False,sports
653,Cristiano Ronaldo scores a goal in his return to Manchester United after 12 years,,https://streamwo.com/e4YgefA,False,False,sports
654,"After being under siege for the first quarter of the match, Nathan Cleary kicks the ball perfectly into open space behind the opposition to set up teammate Stephen Crichton.",,,False,True,sports
655,Baylor stops Oklahoma State within the 1-yard line on 4th Down to win the Big 12 Championship,,,False,True,sports
656,"Moriah Wilson shot and killed in Austin, Texas",,https://www.velonews.com/news/moriah-wilson-shot-and-killed-in-austin-texas/,False,False,sports
657,United States high jumper Erik Kynard to get 2012 Olympic gold medal from Russian doper.,,https://www.espn.com/olympics/story/_/id/32614812/united-states-high-jumper-erik-kynard-get-2012-olympic-gold-medal-russian-doper,False,False,sports
658,Thompson-Herah clocks fastest women's 100m of 2022 in California,,https://www.reuters.com/lifestyle/sports/thompson-herah-clocks-fastest-womens-100m-2022-california-2022-04-17/,False,False,sports
659,"""Fan"" shines laser pointer in Max Muncy's eyes while at bat in a big moment",,https://streamable.com/4s2aap,False,False,sports
660,Kimi Raikkonen to make racing return in NASCAR at Watkins Glen,,https://www.autosport.com/nascar/news/raikkonen-to-make-racing-return-in-nascar-at-watkins-glen/10310913/,False,False,sports
661,'Enough': Kerr reacts to shooting with fervent plea,,https://www.espn.com/nba/story/_/id/33979219/warriors-steve-kerr-delivers-impassioned-plea-gun-control-texas-school-shooting-get-numb-this,False,False,sports
662,Novak Djokovic faces possible 3-year ban from Australia,,https://www.newsweek.com/novak-djokovic-faces-3-year-ban-tennis-australia-open-visa-saga-1669830,False,False,sports
663,NFL star Christian McCaffrey pays off layaway charges for military members,,https://www.cnn.com/2021/12/24/us/mccaffrey-layaway-military-trnd/index.html,False,False,sports
664,"F1 terminates Russian TV contracts, ends F1 TV availability",,https://www.motorsport.com/f1/news/f1-terminates-russian-tv-contracts-ends-f1-tv-availability/8873427/,False,False,sports
665,Anthony Pernice lifts 550 kg/1213 lbs for an all-time world record,,,False,True,sports
666,Miami Dolphins acquire Kansas City Chiefs WR Tyreek Hill,,https://www.espn.com/nfl/story/_/id/33578433/sources-miami-dolphins-acquire-kansas-city-chiefs-wr-tyreek-hill-five-draft-picks,False,False,sports
667,Polish Paralympic cycling medalist Marcin Polak tests positive for doping.,,https://www.espn.com/olympics/story/_/id/32093830/polish-paralympics-cycling-medalist-marcin-polak-tests-positive-doping,False,False,sports
668,Euro 2020: England charged by Uefa after 'laser' penalty incident,,https://www.bbc.com/sport/football/57763001?at_custom2=facebook_page&at_custom3=BBC+News&at_campaign=64&at_custom1=%5Bpost+type%5D&at_medium=custom7&at_custom4=FB1A69E4-DFD8-11EB-9A7C-10C0BDCD475E,False,False,sports
669,A 3-time pentathlon world champion says the Olympic horse-punch saga was just the latest incident in a long history of the sport neglecting horse welfare,,https://www.insider.com/modern-pentathlon-long-history-horse-neglect-world-champion-says-2021-11,False,False,sports
670,New Zealand rugby star Ruby Tui gives a wholesome post-match interview that epitomizes the Olympic spirit,,,False,True,sports
671,"Bucs Wide Receiver Antonio Brown takes off his jersey & pads mid-game, then exits the field against the NY Jets",,https://streamable.com/63vyao,False,False,sports
672,Minnesota Timberwolves signee Greg Monroe becomes record 541st player to play in NBA this season,,https://www.espn.com/nba/story/_/id/32949469/minnesota-timberwolves-signee-greg-monroe-becomes-record-541st-player-play-nba-season,False,False,sports
673,Photos of missing Chinese tennis player Peng Shuai posted online.,,https://www.espn.com/tennis/story/_/id/32671331/photos-missing-chinese-tennis-star-peng-shuai-posted-online,False,False,sports
674,The Los Angeles Dodgers walk off the Cardinals with a Chris Taylor home run in the NL Wild Card Game,,,False,True,sports
675,Ukraine's Oleksii Novikov takes first place in the Dumbbell Ladder,,,False,True,sports
676,Ashleigh Barty becomes first Australian woman to win Wimbledon single's title in 41 years,,https://www.cnn.com/2021/07/10/tennis/ashleigh-barty-karolina-pliskova-wimbledon-final-spt-intl/index.html,False,False,sports
677,Sir Frank Williams has passed away at age 79.,,https://twitter.com/F1/status/1464963052810481666?t=80LsGUZGT0EeA3j0YUDjkw&s=19,False,False,sports
678,Aaron Rodgers passes Brett Favre for the most passing touchdowns by a Packer,,,False,True,sports
679,Aaron Ramsdale makes an miraculous double save for Arsenal vs Leicester City,,,False,True,sports
680,The 49ers comeback from a 17–0 deficit and clinch a playoff berth after Rams QB Matthew Stafford throws a game-losing interception in overtime,,,False,True,sports
681,"Unbelievable Catch taken by Harleen Deol, India 🇮🇳 v/s England 🇬🇧",,,False,True,sports
682,"Thor ""The Mountain"" Bjornsson beats Mateusz ""The Terminator"" Kieliszkowski at the Loading Race during the 2018 World's Strongest Man contest",,,False,True,sports
683,Transgender runner CeCe Telfer ruled ineligible for U.S. Olympic trials.,,https://www.espn.com/olympics/story/_/id/31697910/transgender-runner-cece-telfer-ruled-ineligible-us-olympic-trials,False,False,sports
684,Iceland PM saddened by football sex abuse scandal,,https://www.bbc.com/news/world-europe-58407789,False,False,sports
685,Novak Djokovic has Covid-19 vaccination 'exemption' to play at Australian Open,,https://www.skysports.com/tennis/news/12110/12508781/novak-djokovic-has-covid-19-vaccination-exemption-to-play-at-australian-open,False,False,sports
686,Rob Kearney takes 1st place in the Car Carry during the 2022 World's Strongest Man contest,,,False,True,sports
687,Shikha Pandey with possibly the best ball in women's cricket history,,,False,True,sports
688,Jamie Vardy heads the ball over Foster to put it straight into the back of the net.,,,False,True,sports
689,Texas Tech steals home to beat #2 Texas!,,,False,True,sports
690,"Giannis Antetokounmpo is overcome with emotion courtside after winning his first NBA Championship, the second on Milwaukee Bucks' history",,,False,True,sports
691,Cricket fielder hits stumps at both ends with one throw to run batter out,,,False,True,sports
692,David Ortiz inducted into baseball Hall of Fame in first year on the ballot,,https://www.espn.com/mlb/story/_/id/33145769/former-boston-red-sox-slugger-david-ortiz-lone-inductee-baseball-hall-fame-barry-bonds-roger-clemens-miss-again,False,False,sports
693,"Lightning Win Game 7, 1-0, and Advance to Stanley Cup Final",,https://lastwordonsports.com/hockey/2021/06/25/tampa-bay-lightning-win-advance-to-stanley-cup-final/,False,False,sports
694,Tom Brady: Why the NFL shouldn’t allow players to wear almost any number,,https://www.tampabay.com/sports/2021/09/07/tom-brady-why-the-nfl-shouldnt-allow-players-to-wear-almost-any-number/,False,False,sports
695,"Schalke 04, already financially at extreme risk, end relationship with main sponsor Gazprom after invasion of ukraine.",,https://sports.yahoo.com/schalke-end-gazprom-sponsorship-early-103841612.html,False,False,sports
696,"Unvaccinated pro athletes no longer able to enter Canada as of Jan. 15, says minister",,https://www.cbc.ca/sports/mendicino-athlete-vaccination-exemption-1.6256370,False,False,sports
697,"Italy stun Wales with last minute try to end a run of 36 consecutive Six-Nations defeats, their first win since 2015",,https://twitter.com/SixNationsRugby/status/1505214398591344647,False,False,sports
698,Michigan defeats ohio in little league baseball world series,,https://www.usatoday.com/story/sports/2021/08/29/michigan-defeats-ohio-win-little-league-world-series-championship/5642973001/,False,False,sports
699,Boundary save by Nattakam Chantam,,,False,True,sports
700,Brooklyn Nets Won't Play Irving Until He Meets Vaccine Requirement,,https://apnews.com/article/kyrie-irving-covid-vaccine-nets-dcd6d5c6d027934cf763dc167610ce58,False,False,sports
701,Former Blackhawks player alleges he was sexually assaulted by coach - TSN.ca,,https://www.tsn.ca/talent/former-blackhawks-player-alleges-he-was-sexually-assaulted-by-coach-1.1639402,False,False,sports
702,England and Argentina stop playing when they realise they'll both make the play-offs,,,False,True,sports
703,U.S. women ski jumpers won't compete in the Beijing Olympics after failing to qualify,,https://www.npr.org/2022/01/07/1070147101/u-s-women-ski-jump-winter-olympics-beijing-china,False,False,sports
704,Four-time US Olympian hammer thrower and Ashland University head track and field coach Jud Logan passes away from COVID.,,https://www.cantonrep.com/story/sports/college/2022/01/03/jud-logan-death-four-time-olympics-hammer-ashland-university-track-and-field-coach-north-canton/9075372002/,False,False,sports
705,Zach Johnson hits it sideways,,,False,True,sports
706,"Pittsburgh Steelers hire Brian Flores, who is suing the NFL for racial discrimination, as assistant coach",,https://www.cnn.com/2022/02/19/sport/brian-flores-hired-pittsburgh-steelers-spt/index.html,False,False,sports
707,Vaccine slam dunk: Nearly every WNBA player has been immunized against Covid-19,,https://www.nbcnews.com/news/us-news/vaccine-slam-dunk-nearly-every-wnba-player-has-been-immunized-n1272532,False,False,sports
708,Colorado Avalanche Fans Sing Blink-182 Song In Unison,,https://youtu.be/y2fc7o7IAo4,False,False,sports
709,"Yaremchuck, a Ukrainian striker for Benfica, was brought on to a standing ovation from both fans attending the match He was also given the captain’s armband How can you not be emotional? 🇺🇦",,,False,True,sports
710,"Unlike other sports stars, Andy Murray won't play in Saudi | AP News",,https://apnews.com/article/novak-djokovic-sports-entertainment-jamal-khashoggi-formula-one-e6c17beb6214da37742b8ceae78b926f,False,False,sports
711,Evans recovers the ball after the fumble after the lateral after the fumble after the pass by Evans.,,,False,True,sports
712,"Climate change will make skiing an even more exclusive, less diverse sport",,https://www.fastcompany.com/90723619/climate-change-will-make-skiing-an-even-more-exclusive-less-diverse-sport,False,False,sports
713,Scott Howard of UGA radio after Kelee Ringo's pick six to ice the CFP Championship,,,False,True,sports
714,372kph backhand smash by Lee Zii Jia,,,False,True,sports
715,"Travis Kelce shows off his yards-after-the-catch ability, cutting through the Chargers defense to score the game-winning touchdown for the Kansas City Chiefs",,,False,True,sports
716,Novak Djokovic: Tennis star wins court battle to stay in Australia,,https://www.bbc.co.uk/news/live/world-australia-59909477,False,False,sports
717,Dallas Cowboys QB Dak Prescott sets the franchise record for touchdown passes in a season (37) in a Week 18 matchup against the Eagles,,,False,True,sports
718,"San Marino 🇸🇲 just won their second medal ever.With 2 medals per 34000 residents,it's also the country with the most medals per capita in the world now!",,https://edition.cnn.com/world/live-news/tokyo-2020-olympics-07-31-21-spt/h_b4f4c19a137a8c3aa54f30657729a8bd,False,False,sports
719,Purdue offensive lineman Greg Long 'chugs' beer thrown on field at Iowa's Kinnick Stadium,,https://www.usatoday.com/story/sports/ncaaf/bigten/2021/10/16/purdue-lineman-greg-long-chugs-thrown-beer/8494735002/,False,False,sports
720,Badr Hari knocking out Stefan Leko,,,False,True,sports
721,"New England's 56-yard, go-ahead field goal attempt doinks off the right upright and seals the 19–17 victory for the Tampa Bay Buccaneers. Tom Brady has now beaten all 32 NFL teams in his career.",,,False,True,sports
722,"Georgia Bulldogs win first college football national title since 1980, beat defending champ and longtime nemesis Alabama 33-18",,https://www.cbsnews.com/news/georgia-bulldogs-college-football-national-champions-alabama/,False,False,sports
723,Michigan running back Hassan Haskins hurdles over an Ohio State defender,,https://gfycat.com/jubilantordinaryamericanlobster,False,False,sports
724,"Novak Djokovic likely to get COVID-19 vaccine after Rafael Nadal's Australian Open win, biographer says",,https://www.cbssports.com/tennis/news/novak-djokovic-likely-to-get-covid-19-vaccine-after-rafael-nadals-australian-open-win-biographer-says/,False,False,sports
725,Novak Djokovic comes back from two sets down to win French Open final. Djokovic is first man in Open Era to win every Grand Slam twice,,https://lastwordonsports.com/tennis/2021/06/13/novak-djokovic-win-french-open/,False,False,sports
726,"Eddie Hall breaks crossfit ""Isabel"" World Record in his first attempt",,,False,True,sports
727,"Amine Gouiri with mad skills setting up a goal for Nice in the semi-finals of the Coupe de France, against FC Versailles",,,False,True,sports
728,Fiji has won gold in Rugby Sevens - Men’s at Tokyo 2020. They have retained their Olympics crown from Rio 2016.,,http://twitter.com/Tokyo2020/status/1420314266612076547,False,False,sports
729,"Kelly slater wins pipeline pro one week before his 50th birthday, and 30 years after his first win at this location.",,,False,True,sports
730,Raiders QB Derek Carr tosses the game-winning touchdown pass in overtime on Monday Night Football,,,False,True,sports
731,Rally driver hit a deer in middle of race,,,False,True,sports
732,Norwegian women's beach-handball team forced to pay fines after players wore shorts - instead of bikini bottoms - during a game,,https://news.yahoo.com/norwegian-womens-beach-handball-team-172201500.html?guccounter=1&guce_referrer=aHR0cHM6Ly93d3cuZ29vZ2xlLmNvbS8&guce_referrer_sig=AQAAAGx6pbmLoA87NkW_uRNwjpzWN-Y2F7G8bb7rbBvp6soRStwIiswtlUrWqTGw3zsVPCw0AYowm_us7N3jBbr_-sfOSo1t31co_IzSz_D-o9LChDCUHiOYP2GyRQP9RWUT7gy__vogi6va3mfZ0kZjL8BFBlbCemh1aER3sZxWFP2b,False,False,sports
733,Sweden dominates U.S. women's soccer team in a 3-0 victory in their opener at Tokyo Olympics,,https://eu.usatoday.com/story/sports/columnist/nancy-armour/2021/07/21/us-womens-soccer-team-falls-sweden-embarrassing-loss/8038234002/,False,False,sports
734,Dylan Alcott wins second Wimbledon singles wheelchair title,,https://www.abc.net.au/news/2021-07-10/wimbledon-dylan-alcott-beats-sam-schroderin-final/100283932,False,False,sports
735,Oleksii Novikov On His Way To Winning The World's Strongest Man 2020 Deadlifts A World Record 1185 lbs Last November In Bradenton Florida At The Age Of 24.,,,False,True,sports
736,Ole Miss WR Braylon Sanders makes a one-handed grab along the sideline against Alabama,,,False,True,sports
737,Hat trick of Own Goals by New Zealand Defender in She Believes Cup,,https://www.espn.com/video/clip/_/id/33337194,False,False,sports
738,I've never seen a goalkeeper attempt a penalty kick before. Olivia McDaniel stuffs 2 penalty attempts and converts her own attempt to send Philippines to the FIFA Women's World Cup for the First Time,,,False,True,sports
739,"Report: NFL owners are ""counting votes"" toward a possible ouster of Daniel Snyder - ProFootballTalk",,https://profootballtalk.nbcsports.com/2022/05/21/report-nfl-owners-are-counting-votes-toward-a-possible-ouster-of-daniel-snyder/,False,False,sports
740,MLB kills Rays’ split-city plan with Montreal,,https://www.tampabay.com/sports/rays/2022/01/20/mlb-kills-rays-split-city-plan-with-montreal/,False,False,sports
741,A few months the newly crowned Miami champion Hubert Hurkacz (ranked 16) had zero questions during his press conference. Today he defeated Roger Federer 6-3 7-6 6-0 at Wimbledon,,,False,True,sports
742,Djokovic out of US events due to being unvaxxed,,https://www.espn.com/tennis/story/_/id/33463692/novak-djokovic-two-events-due-us-covid-19-travel-restrictions,False,False,sports
743,Rajapaksa takes a stunner | WI v SL | ICC Men's T20WC 2021,,,False,True,sports
744,"Coach Brian Flores Suing NFL & NY Giants, Claims Coaching Search Racist, & Bill Belichick Text Proves It",,https://www.tmz.com/2022/02/01/coach-brian-flores-suing-nfl-and-ny-giants-claims-search-racist/,False,False,sports
745,Yuriy Vernydub: Sheriff Tiraspol manager 'not afraid' as he leaves Europa League side to fight in Ukraine,,https://www.bbc.com/sport/football/60601469,False,False,sports
746,"Max Verstappen as a child with his idol, Micheal Schumacher.",,,True,False,sports
747,"Dak Prescott finds CeeDee Lamb on a game-winning, overtime-ending touchdown pass. The 35–29 win gives the Cowboys a 5–1 record to start the season.",,,False,True,sports
748,Prosecutors say former Los Angeles Angels employee Eric Kay asked drug suppliers to deliver opioids to stadium.,,https://www.espn.com/mlb/story/_/id/32074571/prosecutors-say-former-angels-employee-asked-drug-suppliers-deliver-opioids-stadium,False,False,sports
749,"Jaguars QB Trevor Lawrence saves a bad, high snap and rolls out to find Marvin Jones for a touchdown against the Colts, giving Jacksonsville a three-score lead.",,,False,True,sports
750,"Sam Jones, Hall of Famer who won 10 NBA titles with Boston Celtics, dies at 88",,https://www.espn.com/nba/story/_/id/32968550/sam-jones-won-10-nba-titles-boston-celtics-dies-age-88,False,False,sports
751,Former NBA players charged in $4M health care fraud scheme,,https://www.espn.com/nba/story/_/id/32354861/former-nba-players-charged-4m-health-care-fraud-scheme,False,False,sports
752,Mitchell Starc gets a wicket on the first ball of the First Ashes Test Match with a swinging delivery,,,False,True,sports
