,title,content,link,image,video,category
0,"Dee Snider says he ""absolutely"" approves of Ukrainians using Twisted Sister's We’re Not Gonna Take It as their battlecry",,https://www.loudersound.com/news/dee-snider-says-he-absolutely-approves-of-ukrainians-using-twisted-sisters-were-not-gonna-take-it-as-their-battlecry,False,False,entertainment
1,Brendan Fraser fought back tears after learning that everyone online is 'rooting' for him to succeed,,https://www.insider.com/brendan-fraser-martin-scorsese-movie-tiktok-support-emotional-reaction-2021-8,False,False,entertainment
2,Ricky Gervais says: 'I would not have made a joke about his wife’s hair. I would have made a joke about her boyfriend',,https://vt.co/entertainment/ricky-gervais-says-i-would-not-have-made-a-joke-about-his-wifes-hair-i-would-have-made-a-joke-about-her-boyfriend,False,False,entertainment
3,"KISS’ Paul Stanley calls Kim Kardashian’s business advice “an insult to millions of women” ""Kim, You were born rich. Embrace it with grace by not being blind""",,https://www.nme.com/news/music/kiss-paul-stanley-calls-kim-kardashians-business-advice-an-insult-to-millions-of-women-3181260,False,False,entertainment
4,"Dollywood, Dolly Parton's amusement park, announced that the company will cover 100% of tuition, fees and books for any Dollywood employee who chooses to pursue further education. This will be offered to all seasonal, part-time, and full-time employees, and they can enroll day 1 of their employment.",,https://fox17.com/news/local/dream-more-dollywood-to-pay-100-of-tuition-textbooks-for-employees-pursuing-education-pigeon-forge-tennessee-herschend-enterprises,False,False,entertainment
5,Michael Bay: ‘I Don’t Care’ About Will Smith Slap When ‘Babies Are Getting Blown Up in Ukraine’,,https://variety.com/2022/film/news/michael-bay-shuts-down-will-smith-slap-question-1235224377/,False,False,entertainment
6,DiCaprio donates a record $10 million to the Armed Forces of Ukraine: his mother was born in a bomb shelter during an air raid,,https://thesaxon.org/dicaprio-donates-a-record-10-million-to-the-armed-forces-of-ukraine-his-mother-was-born-in-a-bomb-shelter-during-an-air-raid/,False,False,entertainment
7,Ukraine-born Mila Kunis and husband Ashton Kutcher pledge to match $3 million in aid donations,,https://www.washingtonpost.com/world/2022/03/05/mila-kunis-ashton-kutcher-ukraine-refugee-fundraiser/,False,False,entertainment
8,Blake Lively and Ryan Reynolds Promise to Match Donations to Ukrainian Refugees Up to $1 Million,,https://people.com/movies/ukraine-blake-lively-ryan-reynolds-pledge-match-donations-ukrainian-refugees/,False,False,entertainment
9,Howard Stern: Supreme Court Justices Who Ban Abortion Should Raise Every Unwanted Child,,https://variety.com/2022/digital/news/howard-stern-slams-supreme-court-justices-abortion-1235257602/,False,False,entertainment
