,title,content,link,image,video,category
456,"Jeremy Lin Leaves NBA, Returns to Beijing Ducks",,https://radiichina.com/jeremy-lin-beijing-ducks/,False,False,sports
457,Kevin Durant leads US men to fourth consecutive Olympic basketball gold medal with a 87-82 win over France,,https://abcnews.go.com/Sports/wireStory/kevin-durant-leads-us-men-fourth-consecutive-olympic-79329977,False,False,sports
458,Tiger Woods chip shot in the Masters (2005),,,False,True,sports
459,Unbelievable try with an unbelievable finish by Mark Telea for the Blues vs the Rebels in the Super Rugby Pacific,,,False,True,sports
460,Bailey Peacock-Farrell with an astonishing double save for Sheffield Wednesday vs Crewe Alexandra this afternoon in the English League One.,,,False,True,sports
461,Inside Joe Burrow's legendary 525-yard performance vs. Ravens: Bengals QB has fourth-most yards in NFL history,,https://www.cbssports.com/nfl/news/inside-joe-burrows-legendary-525-yard-performance-vs-ravens-bengals-qb-has-fourth-most-yards-in-nfl-history/,False,False,sports
462,Enrique Hernandez sends the Red Sox to the ALCS with a walk-off sacrifice flyball to beat the Tampa Bay Rays,,,False,True,sports
463,Jordan Pickford fabulously saves two consecutive shots against Chelsea.,,,False,True,sports
464,415 KPH smash in badminton (Indonesian player - Daniel Marthin),,,False,True,sports
465,James Conrad throws in a 200+ foot shot to force a playoffs in the Disc Golf Worlds Championship,,https://v.redd.it/cv5mdan4rp771,False,False,sports
466,Yankees star Derek Jeter inducted into Baseball Hall of Fame,,https://apnews.com/article/lifestyle-entertainment-sports-mlb-baseball-26db0a05eb78045ca12b740e4ef552a6,False,False,sports
467,great teamwork goals from galatasaray against locomotiv moscow few days ago,,,False,True,sports
468,"Tony Romo talks candidly about making the greatest play of his career in the final moments of the 2014 NFC Divisional Playoff game against the Green Bay Packers, only for the referees to take it away. Three years later, the league would officially state that Dez caught it.",,,False,True,sports
469,"BREAKING: Australia cricket legend, Shane Warne, dies aged 52 of ‘suspected heart attack’",,https://www.foxsports.com.au/cricket/australia/shane-warne-dies-death-age-cause-of-death-australia-legend-passes-away-in-thailand-of-suspected-heart-attack/news-story/2871d970df662a247709703aa287ce84,False,False,sports
470,Canelo Alvarez Knocks Caleb Plant Out in Eleventh,,,False,True,sports
471,"While dealing with an injured hip and less than a minute left in the game, Fresno State quarterback Jake Haener leads his team down the field and throws the game-winning touchdown at 13th-ranked UCLA",,,False,True,sports
472,"Deandra Dottin, A West Indies cricketer takes a spectacular catch",,,False,True,sports
473,"Johnny Bench: ""It is with great regret that I will not be able to attend this year’s Baseball Hall of Fame induction after testing positive for COVID. Fortunately, I have been vaccinated, otherwise doctor said I would be hospitalized.""",,https://twitter.com/JohnnyBench_5/status/1433851618252972032,False,False,sports
474,"BBC News apologise after ""Manchester United are rubbish"" appears on screen",,https://www.mirror.co.uk/sport/football/news/bbc-news-man-united-rubbish-27051181,False,False,sports
475,The Last Touchdown pass of Tom Brady’s career,,,False,True,sports
476,Mongolian wrestling coaches strips after losing the bronze medal match - Rio Olympics 2016,,,False,True,sports
477,"Kansas City Chiefs fans, in nod to Bills Mafia, donate $178,000 to Buffalo children's hospital",,https://www.espn.com/nfl/story/_/id/33152010/kansas-city-chiefs-fans-nod-bills-mafia-donate-178000-buffalo-children-hospital,False,False,sports
478,Novak Djokovic: Having Covid gave tennis star vaccine exemption - lawyers,,https://www.bbc.com/news/world-australia-59920379,False,False,sports
479,"Montreal Canadiens Win Game 6, Advance to Stanley Cup Final - LWOH",,https://lastwordonsports.com/hockey/2021/06/24/montreal-canadiens-win-game-6/,False,False,sports
480,Formula 1: Haas part ways with Russian driver Nikita Mazepin ‘with immediate effect’,,https://www.formula1.com/en/latest/article.breaking-haas-to-part-ways-with-nikita-mazepin-with-immediate-effect.nmmqyclyJjFNkPJjQyiyF.html,False,False,sports
481,Rodrygo’s two injury-time goals for Real Madrid vs. Manchester City to tie the aggregate score. Madrid go on win the Champions League Semi-Final minutes later.,,,False,True,sports
482,Tom Brady says he had COVID-19 after Super Bowl boat parade; expects virus to be more of a factor this season,,https://www.cbssports.com/nfl/news/tom-brady-says-he-had-covid-19-after-super-bowl-boat-parade-expects-virus-to-be-more-of-a-factor-this-season/,False,False,sports
483,Chris Lynn hits one out of the Gabba!,,,False,True,sports
484,Dallas Cowboys WR Michael Gallup twists and turns in the air to make a touchdown catch in the corner of the endzone on Thursday Night Football,,https://gfycat.com/weightypalatableindiancow,False,False,sports
485,Switzerland stun France on penalties. Reigning world champions have been eliminated from the European championship,,https://www.theguardian.com/football/live/2021/jun/28/france-v-switzerland-euro-2020-last-16-score-updates-live,False,False,sports
486,[BBC] Wimbledon bans Russian and Belarusian players,,https://www.bbc.co.uk/sport/tennis/61161016,False,False,sports
487,"Tom Brady and the Buccaneers utilize the no-huddle offense all the way down the field against the New York Jets, leading to a Cyril Grayson go-ahead toucdown",,,False,True,sports
488,Serena Williams says she's not going to Tokyo Olympics.,,https://www.espn.com/olympics/summer/tennis/story/_/id/31718541/serena-williams-says-not-going-tokyo-olympics,False,False,sports
489,Roman Abramovich completes $5.3 billion sale of Chelsea FC to group led by LA Dodgers co-owner Todd Boehly and Clearlake investment firm,,https://www.businessinsider.com/roman-abramovich-completes-sale-chelsea-owner-la-dodgers-todd-boehly-2022-5,False,False,sports
490,Sky Diving With Skis From The Ultimate Chairlift (Fred Fugen for Red Bull),,,False,True,sports
491,"""I see it, but I don't believe it"" Nick Davis Kicks 4 Goals in the 4th Quarter to Save the Sydney Swans Season (2005)",,,False,True,sports
492,Robbie Savage commentates on his son Charlie making his debut for Manchester United,,,False,True,sports
493,"Golf legend Lee Elder, first Black player to compete in the Masters, dies at 87",,https://www.cbssports.com/golf/news/golf-legend-lee-elder-first-black-player-to-compete-in-the-masters-dies-at-87/,False,False,sports
494,Four-time world champion Sebastian Vettel stays behind to clean up the stands after Silverstone GP,,,False,True,sports
495,Ukraine's Oleksii Novikov breaks the record in the Flintstone Lift during the 2022 World's Strongest Man contest,,,False,True,sports
496,NASCAR Team Owner Richard Childress offers 1 Million Rounds of Ammunition to Ukraine.,,https://twitter.com/mjburroughs/status/1499025704763150340?s=21,False,False,sports
497,Maple Leafs star Mitch Marner carjacked at gunpoint in Toronto,,https://nationalpost.com/news/local-news/exclusive-maple-leafs-star-mitch-marner-victim-of-etobicoke-carjacking/wcm/d849e6da-8d91-4af4-b9f7-bfbc273baf34,False,False,sports
498,"Tony hawks 900, one of the most memorable moments in skate history",,,False,True,sports
499,Funso Ojo was sent off after an altercation with a Dundee United supporter who shoved the Aberdeen midfielder.,,,False,True,sports
500,Simone Biles says she withdrew from finals over mental health concerns,,https://www.cnn.com/world/live-news/tokyo-2020-olympics-07-27-21-spt/h_5adca1df6aee3b6f6b2165725d9c0116?utm_content=2021-07-27T15%3A00%3A08&utm_medium=social&utm_term=link&utm_source=twCNN,False,False,sports
501,US Open Requires Fans to Have at Least One COVID-19 Vaccine Dose,,https://www.insider.com/us-open-requires-fans-one-covid-19-vaccine-dose-2021-8,False,False,sports
502,Opinion: The 'woke mob' didn't come for Aaron Rodgers,,https://www.cnn.com/2021/11/08/opinions/aaron-rodgers-covid-accountability-obeidallah/index.html,False,False,sports
503,"Jacksonville State, a 27.5-point underdog, defeats Florida State on the road with a 59-yard hail mary with no time left",,,False,False,sports
504,I own a beer can from the last time the Georgie Bulldogs won a national championship.,,,True,False,sports
505,Bill Murray sinks no look putt,,,False,True,sports
506,Athletes from Russia and Belarus will not be allowed to compete at the 2022 Winter Paralympics,,https://twitter.com/bbcsport/status/1499283738890584067?s=21,False,False,sports
507,Chelsea among Abramovich assets frozen by UK government,,https://www.bbc.com/sport/live/football/60688168,False,False,sports
508,"Golden State Warriors eliminate Dallas Mavericks, move onto NBA finals. Steph Curry wins Western Conference Finals MVP",,https://www.nbcsports.com/bayarea/warriors/steph-curry-wins-western-conference-finals-mvp-warriors-close-out-mavericks,False,False,sports
509,"Hope Solo arrested on DWI, child abuse charges",,https://www.espn.com/soccer/united-states-usaw/story/4631657/former-uswnt-goalkeeper-hope-solo-arrested-on-dwichild-abuse-charges,False,False,sports
510,"[Kendrick Lamar] Dr. Dre, Snoop Dogg, Eminem, Kendrick Lamar, and Mary J. Blige will headline the Super Bowl LVI Halftime Show.",,https://twitter.com/kendricklamar/status/1443682554146549772,False,False,sports
511,"Karsten Warholm shatters world record in men’s 400-meter hurdles win at Tokyo Olympics, celebrates by ripping shirt",,https://www.denverpost.com/2021/08/02/karsten-warholm-mens-400-meter-hurdles-tokyo-olympics/,False,False,sports
512,Australia joins diplomatic boycott of Beijing Olympics.,,https://www.espn.com.au/olympics/story/_/id/32815868/australia-joins-diplomatic-boycott-beijing-olympics,False,False,sports
513,Jon Jones arrested on domestic violence charge,,https://www.espn.com/mma/story/_/id/32270778/ufc-star-jon-jones-arrested-misdemeanor-domestic-violence-charge-las-vegas,False,False,sports
514,Novak Djokovic will be allowed play at the French Open even if unvaccinated - France's sports minister.,,https://www.espn.co.uk/tennis/story/_/id/33011964/novak-djokovic-allowed-play-french-open-even-unvaccinated-france-sports-minister,False,False,sports
515,Gregg Popovich becomes winningest coach in NBA regular-season history,,https://www.npr.org/2022/03/12/1081377130/gregg-popovich-coach-win-record-nba-history,False,False,sports
516,Behind-the-back pass South Africa vs New Zealand,,,False,True,sports
517,"The story of Rube Waddell, Hall of Fame pitcher for the Philadelphia Athletics, a man who opponents could distract by holding up puppies, and was liable to chase after fire trucks in the middle of a game if he heard their bells",,,False,True,sports
518,Another lawsuit filed against Deshaun Watson after HBO’s 'Real Sports' story,,https://www.chron.com/sports/texans/article/Deshaun-Watson-civil-lawsuit-another-sex-massage-17210611.php,False,False,sports
519,"Brentford, who return to the Premier League for the first time in 74 years, beat Arsenal 2-0.",,https://www.premierleague.com/match/66342,False,False,sports
520,Drew Brees picks the Saints to beat Tom Brady and the Buccaneers,,,False,True,sports
521,German soccer club Schalke 04 removes Gazprom logo from shirts,,https://www.reuters.com/lifestyle/sports/german-soccer-club-schalke-04-removes-gazprom-logo-shirts-2022-02-24/,False,False,sports
522,Speedy Djokovic,,,False,True,sports
523,"Texas A&M kicker Seth Small drills the field goal with no time left to defeat #1 ranked Alabama, ending Alabama's 19-game winning streak",,,False,True,sports
524,Charles Barkley: ‘I Root Against All Superteams’,,https://www.si.com/nba/2021/06/10/charles-barkley-nba-playoffs-nets-superteam,False,False,sports
525,Tokyo Olympics will be held without spectators - Games minister,,https://www.reuters.com/lifestyle/sports/tokyo-olympics-will-be-held-without-spectators-games-minister-2021-07-08/,False,False,sports
526,Bills WR Isaiah McKenzie gets vaccinated after fine,,https://www.reuters.com/lifestyle/sports/bills-wr-isaiah-mckenzie-gets-vaccinated-after-fine-2021-08-28,False,False,sports
527,"Cam Newton scores a touchdown—and screams ""I'm back!""—in his return to the Carolina Panthers",,,False,True,sports
528,Mbappé's goal vs Real Madrid in the UCL round of 16,,,False,False,sports
529,Russian Bid To Play In World Cup Soccer Qualifying Is Rejected,,https://www.huffpost.com/entry/russia-appeal-world-cup-qualifying-denied_n_62349f2be4b0f1e82c4936b1,False,False,sports
530,"Hue Jackson accuses Cleveland Browns of incentivizing losing during 2016, '17 football seasons",,https://www.espn.com/nfl/story/_/id/33202029/hue-jackson-accuses-cleveland-browns-paying-tank-2016-17,False,False,sports
531,Pittsburgh Steelers QB Dwayne Haskins dies after being hit by car,,https://www.espn.com/nfl/story/_/id/33706232/pittsburgh-steelers-qb-dwayne-haskins-dies-being-hit-car,False,False,sports
532,Leigh Wood knocks Michael Conlan out of the ring as he wins an epic battle in the final round to retain WBA featherweight title,,,False,True,sports
533,"The entire stadium stands up and applauds Brentford's Christian Eriksen, who returns to competitive action 259 days after suffering a cardiac arrest at Euro 2020",,,False,True,sports
534,Tennis champion Boris Becker jailed over bankruptcy,,https://www.bbc.co.uk/news/uk-61276378,False,False,sports
535,Washington Nationals player Victor Robles takes the field with his pet Praying Mantis on his hat. He then confirms the number of outs in the inning with it.,,https://gfycat.com/meekvariablearchaeopteryx,False,False,sports
536,Canadian Damian Warner wins gold medal in Decathalon,,https://toronto.citynews.ca/2021/08/05/canadian-damian-warner-wins-gold-medal-in-the-mens-decathlon/,False,False,sports
537,"Minnesota Vikings fire head coach Mike Zimmer, GM Rick Spielman",,https://www.espn.com/nfl/story/_/id/33034349/reports-minnesota-vikings-fire-head-coach-mike-zimmer-gm-rick-spielman,False,False,sports
538,England stuns Germany with two late goals to book place in Euro 2020 quarterfinals,,https://www.cnn.com/2021/06/29/football/england-germany-wembley-euro-2020-spt-intl/index.html,False,False,sports
539,"Alireza beiranvand, Iranian goalkeeper holding the world record for the farthest ball throw at an official football match- 61m",,,False,True,sports
540,"Golden State Warriors owner says he “doesn’t care” about the Uyghur genocide, questions whether it is taking place, and says PRC is not a dictatorship and no worse than USA",,https://twitter.com/michaelsobolik/status/1483105641656897540?s=21,False,False,sports
541,Why Brittney Griner was in Russia and what it has to do with U.S. women's basketball,,https://www.npr.org/2022/03/07/1084945010/brittney-griner-russia-wnba?sc=18&f=1001,False,False,sports
542,Mariners picked off twice in one inning.,,,False,True,sports
543,"Dairion Asprilla, Bicycle Goal, Portland Timbers vs San Jose Earthquakes October 27th 2021",,,False,True,sports
544,"Women detail new sexual assault, misconduct allegations against ex-U.S. Snowboard coach Peter Foley",,https://www.espn.com/olympics/snowboarding/story/_/id/33564119/women-detail-new-sexual-assault-misconduct-allegations-ex-us-snowboard-coach-peter-foley,False,False,sports
545,Stunning goal by Tunisian midfielder Ilyas Skhiri,,,False,True,sports
546,Messi's Great goal against RC Lens today,,,False,True,sports
547,Russian track doping suspension extended into seventh year.,,https://www.espn.com/olympics/trackandfield/story/_/id/32653593/russian-track-doping-suspension-extended-7th-year,False,False,sports
548,Mateusz Kieliszkowski wins the Push & Pull Race,,,False,True,sports
549,19-year-old substitute Josh Coburn thumps the ball past Hugo Lloris as Middlesbrough pull off another big upset in the FA Cup knocking out Tottenham Hotspurs,,,False,True,sports
550,"Track and field chief cites Sha’Carri Richardson’s absence, says marijuana ban should be reviewed",,https://www.washingtonpost.com/sports/olympics/2021/07/27/shacarri-richardson-track-and-field-chief-marijuana-ban-reviewed/,False,False,sports
551,Red Sox hit two grand slams to even ALCS with Astros,,https://www.chron.com/sports/astros/article/Houston-Astros-Boston-Red-Sox-ALCS-Game-2-story-16538116.php,False,False,sports
552,"Retiring New Zealand batsman Ross Taylor comes on to bowl in his final Test match, and takes the last wicket to win the game",,,False,True,sports
553,Max Verstappen triumphs in pulsating duel with Lewis Hamilton at French GP,,https://www.theguardian.com/sport/2021/jun/20/f1-max-verstappen-lewis-hamilton-french-grand-prix,False,False,sports
554,"Phil Mickelson finishes at 12 over par, misses cut at The Open",,https://www.espn.com/golf/story/_/id/31827994/phil-mickelson-finishes-12-par-misses-cut-open,False,False,sports
555,"Jorge Soler hits a home run to the train tracks in Houston, a shot that gives Atlanta a 3–0 lead in Game Six of the World Series",,,False,True,sports
556,The 49ers block the punt and Hufanga picks it up for a touchdown to tie the game against the Packers,,,False,True,sports
557,Ben Garuccio scores an unbelievable scorpion kick goal in the A-League for Western United.,,,False,True,sports
558,Cristiano Ronaldo's hattrick against Norwich - Premier League,,,False,False,sports
559,"BREAKING: Chris Dickerson, first openly gay IFBB Pro bodybuilder and 1982 Mr. Olympia has passed away at 82. He was also an accomplished opera singer and model.",,,True,False,sports
560,Nadal's overhead in slowmo,,,False,True,sports
561,"The overhead view of Rich Strike's comeback for the Kentucky Derby victory. A massive upset, Rich Strike entered the race at 80-1 odds.",,,False,True,sports
562,Bruno Guimaraes scores an absolutely disgusting back-heel volley to put Newcastle ahead at Southampton in the EPL tonight,,,False,True,sports
563,"""He did it! Oh god, he did it!"" British coaches emotional outburst after Dave Rydings wins historic first ever world cup race for Team GB.",,,False,True,sports
564,"[Adam Schefter] Tom Brady has agreed to join Fox Sports as its lead NFL analyst whenever he stops playing, Lachlan Murdoch announced.",,https://twitter.com/AdamSchefter/status/1524010664355897344?s=20&t=WAi9rlIhcGdKnyaQBSXDug,False,False,sports
565,"Brett Favre repays $600K in welfare case, but Mississippi could sue for interest",,https://www.usatoday.com/story/sports/nfl/2021/10/28/brett-favre-repays-600-k-mississippi-welfare-case/8580202002/,False,False,sports
566,"Ben Roethlisberger was easy to admire as a quarterback, but not as a man | Pittsburgh Steelers",,https://www.theguardian.com/sport/2022/jan/18/ben-roethlisberger-pittsburgh-steelers-quarterback-nfl-sexual-assault-allegations,False,False,sports
567,Ash Barty beats Danielle Collins to end 44-year wait for home Australian Open champion,,https://www.theguardian.com/sport/live/2022/jan/29/ash-barty-v-danielle-collins-australian-open-womens-singles-final-live,False,False,sports
568,Cristiano Ronaldo Scores 50th Hat Trick of His Club Career in Key Victory for Manchester United,,https://people.com/sports/cristiano-ronaldo-50-hat-trick-of-his-career-soccer-victory-manchester-united/?,False,False,sports
569,"Stephen Piscotty is hit by a pitch, gets hit on the elbow while stealing second, and is hit on the head when scoring all in the 5th inning",,,False,True,sports
570,"Tiger Woods says he's 'lucky to be alive,' still have limb after crash.",,https://www.espn.com/golf/story/_/id/32754033/tiger-woods-says-lucky-alive-limb-february-crash,False,False,sports
571,"As Ozzie Cricket legend Shane Warne passes away, here's one of his greatest moments- The Ball of The Century from 1993",,,False,True,sports
572,"Braves OF Adam Duvall hits a grand slam in Game 5 of the World Series, giving the Braves an early 4–0 lead",,,False,True,sports
573,Umpire Angel Hernandez falls into the dugout but still makes the out call,,,False,True,sports
574,Israeli soccer fans subjected to antisemitic abuse at 1st match in Berlin stadium built by the Nazis,,https://www.cbsnews.com/news/jewish-fans-antisemitic-abuse-berlin-maccabi-haifa-olympic-stadium-hitler-nazis/,False,False,sports
575,"Kobe Bryant discussing Shaq's work ethic, ""I wish he was in the gym, I would've had fuckin' twelve rings!'",,http://www.youtube.com/watch?v=PUVnObpACCI,False,False,sports
576,Peter Brock racing in the wet at Mount Panorama using dry weather tyres (1987),,,False,True,sports
577,Two Aussie champions at Wimbledon this year - Ash Barty & Dylan Alcott,,,True,False,sports
578,Sadio Mane assist for Mo Salah goal against Man Utd.,,,False,True,sports
579,PSG women’s player arrested after allegedly sending hit men after her teammate in order to get more playing time.,,https://www.cbssports.com/soccer/news/psg-womens-player-arrested-accused-of-involvement-in-premeditated-attack-on-teammate-per-reports/amp/,False,False,sports
580,New York girls track team members suspended after sports bra protest,,https://www.yahoo.com/news/york-girls-track-team-members-214000807.html,False,False,sports
581,‘Harry Potter’ actor Tom Felton collapses during celebrity golf match at Ryder Cup,,https://www.nbcnews.com/pop-culture/movies/harry-potter-actor-tom-felton-collapses-during-celebrity-golf-match-n1280008,False,False,sports
582,Djokovic rushing in for an athletic point during his run at his 20th major title,,,False,True,sports
583,"Simone Biles to testify before Senate about Larry Nassar | The Sept. 15 hearing concerns the FBI's handling of the investigation into Nassar, who was accused of sexually assaulting hundreds of women and girls.",,https://www.nbcnews.com/politics/congress/simone-biles-testify-senate-about-larry-nassar-n1279076,False,False,sports
584,Jordan Dawson wins the Adelaide Showdown in dramatic fashion with a goal after the siren (AFL),,,False,True,sports
585,Adam Duvall did not hit this slider,,,False,True,sports
586,Sha'Carri Richardson Places Ninth In First Race Since Suspension Over Drug Test,,https://sports.yahoo.com/shacarri-richardson-places-ninth-first-205846317.html,False,False,sports
587,World no.1 Ash Barty announces shock retirement,,https://www.heraldsun.com.au/sport/tennis/ash-barty-retirement-australian-great-walks-away-from-tennis/news-story/9fe430990938d4a7eabc4422fc1a352d?amp&nk=53448c3d970d2b3af5439060ce24d499-1648001079,False,False,sports
588,"""The belt has a great history! And now I won't give it to anyone"" - Amosov took the championship belt his mother had hidden in the ruined Irpen. Bellator welterweight champion Yaroslav Amosov (26-0) is in his second month of defending Ukraine from Russian invaders.",,,False,True,sports
589,Novak Djokovic Defeats Rafael Nadal in French Open Semifinal. Nadal's Record at the French Open Falls to 105-3,,https://lastwordonsports.com/tennis/2021/06/11/novak-djokovic-defeats-rafael-nadal-french-open-semifinal/,False,False,sports
590,"Rams safety Nick Scott takes out Deebo Samuel with a big, clean hit",,,False,True,sports
591,"Georgia lineman Jordan Davis, at 341 pounds, runs 40-yard dash in 4.78 seconds at NFL scouting combine",,https://www.espn.com/nfl/story/_/id/33431396/georgia-lineman-jordan-davis-341-pounds-runs-40-yard-dash-478-seconds-nfl-scouting-combine,False,False,sports
592,Dansby Swanson effortlessly barehands a can of beer thrown to the Braves' moving parade bus,,,False,False,sports
593,Lakers Eliminated from Playoffs With Game 6 Loss to Suns,,https://www.nytimes.com/2021/06/04/sports/basketball/nba-lakers-suns-eliminated-lebron-james.html#click=https://t.co/58wMQHcrsi,False,False,sports
594,"Aaron Rodgers says there’s a “slight chance” he doesn’t play Sunday, wants to move on from vaccination talk - “I’m an athlete; I’m not an activist. So I’m going to get back to doing what I do best.”",,https://www.acmepackingcompany.com/2021/11/9/22772809/aaron-rodgers-covid-corona-update-pat-mcafee-show-green-bay-packers-seattle-seahawks-week-10,False,False,sports
595,"Matthew Stafford, Rams to pay for NFL photographer's medical bills after brutal fall off stage during parade",,https://www.cbssports.com/nfl/news/matthew-stafford-rams-to-pay-for-nfl-photographers-medical-bills-after-brutal-fall-off-stage-during-parade/,False,False,sports
596,Mariusz Pudzianowski wins the Power Stairs during the 2008 World's Strongest Man contest,,,False,True,sports
597,"NFL's vaccine rate at 93%, mandatory shots were discussed",,https://apnews.com/article/sports-nfl-football-health-coronavirus-pandemic-de35ae4c25dcd372dcb519f6d79b1f89,False,False,sports
598,"Rookie JaMarr Chase makes a one-handed catch over arguably the best corner in football, Jalen Ramsey, in Super Bowl LVI",,,False,True,sports
599,Miguel Cabrera hits his 500th career home run.,,https://twitter.com/mlb/status/1429517985799098369?s=21,False,False,sports
600,ATP criticised for not joining WTA action on China in response to Peng Shuai safety concerns.,,https://www.espn.com/tennis/story/_/id/32776626/atp-criticised-not-joining-wta-action-china-response-peng-shuai-safety-concerns,False,False,sports
601,Samoa's big man Tietie Tuimauga showing some lovely hands,,,False,True,sports
602,Cucho Hernández with a fantastic bicycle kick goal for Watford Vs Arsenal in the EPL,,,False,True,sports
603,"Cowboys offensive lineman Terence Steele scores a big man touchdown, catching Dak Prescott's third touchdown pass on a tackle-eligible play",,,False,True,sports
604,Nadal hits 155km/h missile of a return,,,False,True,sports
605,"Naomi Osaka heckled by spectator at BNP Paribas Open, addresses crowd after match",,https://www.cnn.com/2022/03/13/tennis/naomi-osaka-heckled-crowd-paribas-open-spt-intl/index.html,False,False,sports
