,title,content,link,image,video,category
0,Mario Balotelli absolutely filthy goal earlier today.,,,False,True,sports
1,Sebastian Vettel: Former F1 world champion says he will not race at 2022 Russian GP amid Ukraine invasion.,,https://www.skysports.com/f1/news/12433/12550320/sebastian-vettel-former-f1-world-champion-says-he-will-not-race-at-2022-russian-gp-amid-ukraine-invasion,False,False,sports
2,A university cheerleader grabs a stuck ball and gets a standing ovation,,,False,True,sports
3,Neeraj Chopra First Indian To Win Olympic Gold In Athletics,,,False,True,sports
4,Hansel Enmanuel windmilled and then handed the ball to a trash talker,,,False,True,sports
5,Deaf-blind Paralympian quits Team USA when told she can't bring assistant to Tokyo,,https://sports.yahoo.com/blind-deaf-paralympian-becca-meyers-quits-team-usa-when-told-she-cant-bring-assistant-004704299.html,False,False,sports
6,Nicolai unbelievable way to win the set in Tokyo Olympics beach volley match,,,False,True,sports
7,He went ahead and just asked the dude.,,,False,True,sports
8,Ukrainians Zinchenko and Mykolenko in tears as Manchester City and Everton show their fantastic support of Ukraine before their game,,,False,True,sports
9,"Russia and Belarus banned from international ice skating, skiing, basketball and track competition",,https://spectrumlocalnews.com/nys/central-ny/ap-top-news/2022/03/01/russia-excluded-from-skating-as-sporting-sanctions-increase,False,False,sports
