,title,content,link,image,video,category
0,Mario Balotelli absolutely filthy goal earlier today.,,,False,True,sports
1,Sebastian Vettel: Former F1 world champion says he will not race at 2022 Russian GP amid Ukraine invasion.,,https://www.skysports.com/f1/news/12433/12550320/sebastian-vettel-former-f1-world-champion-says-he-will-not-race-at-2022-russian-gp-amid-ukraine-invasion,False,False,sports
2,A university cheerleader grabs a stuck ball and gets a standing ovation,,,False,True,sports
3,Neeraj Chopra First Indian To Win Olympic Gold In Athletics,,,False,True,sports
4,Hansel Enmanuel windmilled and then handed the ball to a trash talker,,,False,True,sports
5,Deaf-blind Paralympian quits Team USA when told she can't bring assistant to Tokyo,,https://sports.yahoo.com/blind-deaf-paralympian-becca-meyers-quits-team-usa-when-told-she-cant-bring-assistant-004704299.html,False,False,sports
6,Nicolai unbelievable way to win the set in Tokyo Olympics beach volley match,,,False,True,sports
7,He went ahead and just asked the dude.,,,False,True,sports
8,Ukrainians Zinchenko and Mykolenko in tears as Manchester City and Everton show their fantastic support of Ukraine before their game,,,False,True,sports
9,"Russia and Belarus banned from international ice skating, skiing, basketball and track competition",,https://spectrumlocalnews.com/nys/central-ny/ap-top-news/2022/03/01/russia-excluded-from-skating-as-sporting-sanctions-increase,False,False,sports
10,Poland refuse to play Russia in World Cup play-off to pile huge pressure on Fifa,,https://www.telegraph.co.uk/football/2022/02/26/poland-refuse-play-russia-world-cup-play-off-pile-huge-pressure/,False,False,sports
11,"Rookie kicker Evan Mcpherson makes the field goal in OT, Bengals defeat Chiefs in Kansas City to advance to first Super Bowl in 33 years",,,False,True,sports
12,"Justin Tucker hits a 66 yard game winning field goal, a new NFL record",,,False,True,sports
13,"Suns center Bismack Biyombo is donating the entirety of his $1.3 million salary for this season, to fund the construction of a hospital in the Democratic Republic of the Congo",,https://www.12news.com/article/sports/nba/suns/suns-bismack-biyombo-using-nba-salary-to-build-a-hospital-in-africa/75-166047ba-18a8-45b2-bc25-deda14e14e01,False,False,sports
14,NBA coach Steve Kerr comments on gun violence in America,,,False,True,sports
15,Italy defeats England in the Euro 2020 Final,,https://www.nytimes.com/live/2021/07/11/sports/england-italy-score-euro-final,False,False,sports
16,"Aaron Rodgers tests positive for COVID-19, and now it's being reported that he lied about being vaccinated in August and is actually unvaccinated.",,https://profootballtalk.nbcsports.com/2021/11/03/aaron-rodgers-was-secretly-unvaccinated/,False,False,sports
17,Atlanta Falcons become first NFL team to be 100 percent vaccinated against Covid,,https://www.nbcnews.com/news/sports/atlanta-falcons-become-first-nfl-team-be-100-percent-vaccinated-n1276938,False,False,sports
18,"With 13 seconds left, no timeouts left and in position for a Hail Mary pass, Cowboys quarterback runs the ball in the middle of the field instead. The Cowboys can't get set in time for another play, the clock runs out and the Cowboys season comes to an end.",,,False,True,sports
19,NFL Legend John Madden Dead At 85,,https://www.tmz.com/2021/12/28/nfl-legend-john-madden-dead-at-85/,False,False,sports
20,"Opinion: If women's tennis has the courage to walk away from Chinese money, the rest of the sports world can, too.",,https://www.yahoo.com/sports/opinion-womens-tennis-courage-walk-182212287.html,False,False,sports
21,Matthew Stafford's no-look pass to Cooper Kupp in the Super Bowl,,,False,True,sports
22,The Russian karter who did the N*zi salute has now lost his racing license,,https://www.motorsport.com/kart/news/russian-karter-loses-racing-licence-nazi-salute/9837571/,False,False,sports
23,Brett Favre urges no tackle football for children under 14,,https://www.nbcnews.com/news/us-news/brett-favre-urges-no-tackle-football-children-under-14-n1276974,False,False,sports
24,Tom Brady officially announces his retirement,,,True,False,sports
25,Brad Marchand steals a random kid’s phone,,,False,True,sports
26,Japan upsets China to win Ping Pong gold,,https://apnews.com/article/2020-tokyo-olympics-sports-china-japan-table-tennis-92cfbb9371314688c1b4e69b904df21b,False,False,sports
27,"Braves Catcher Travis D'Arnaud is hit by a pitch and ""dies""",,,False,True,sports
28,"With this goal, North Macedonia have beaten the current european champions, Italy and knocked Italy out of world cup qualification",,,False,False,sports
29,Aaron Rodgers used ivermectin to treat COVID after consulting with Joe Rogan,,https://www.tmz.com/2021/11/05/aaron-rodgers-covid-19-ivermectin-vaccine-explanation-nfl/,False,False,sports
30,[Pekka Jalonen] BREAKING: Inside information: #Russia and #Belarus will be thrown out of the International Ice Hockey Federation #IIHF in a couple of hours.,,https://twitter.com/pekkajalonen/status/1498276730427035658?s=21,False,False,sports
31,The Yankees and the White Sox emerge from the cornfield for the Field of Dreams Game,,,False,True,sports
32,Ukraine's Oleksii Novikov becomes Europe's Strongest Man,,,False,False,sports
33,BREAKING: WTA announces decision to suspend its tournaments in China,,,True,False,sports
34,Michigan State runningback Kenneth Walker III shakes hands with his wide receiver during his 94-yard touchdown run,,https://gfycat.com/achingliveayeaye,False,False,sports
35,Cleveland Indians announce 'Guardians' as new name,,https://www.wkyc.com/article/sports/mlb/indians/cleveland-indians-guardians-as-new-name/95-14c1ef96-f71c-48eb-80db-1f70a818e46d,False,False,sports
36,Transgender girls and women now barred from female sports in Iowa,,https://www.npr.org/2022/03/03/1084278181/transgender-girls-and-women-now-barred-from-female-sports-in-iowa,False,False,sports
37,"Chinese boxer Xuan Wu Declares ""No Rules are Needed When China Fights Japan"" after violating boxing rules & slammed the Japanese player Sho Kimura's head to the ground during an international combat match",,,False,True,sports
38,"[Highlight] Eli: Let's go to Peyton."" Peyton: ""I can't hear sh*t"" Eli: ""Never mind""",,,False,True,sports
39,"Utah Jazz to fund 32,000 nights of housing for Ukrainian refugees",,https://www.abc4.com/sports/jazz/utah-jazz-to-fund-32000-nights-of-housing-for-ukrainian-refugees/,False,False,sports
40,Pittsburgh QB Kenny Pickett fakes the slide and runs for a 58-yard touchdown in the ACC Championship Game,,,False,True,sports
41,Full Sequence of Miguel Almirón’s Goal for Newcastle vs. Crystal Palace,,,False,False,sports
42,Basketball is beautiful,,,False,True,sports
43,"[Schefter] Tom Brady is retiring from football after 22 extraordinary seasons, multiple sources tell @JeffDarlington and me.",,https://twitter.com/AdamSchefter/status/1487508331967258630?s=20&t=0GdUuyQtPtA9lo-CFOybeQ,False,False,sports
44,NBA star Enes Kanter sports custom Winnie the Pooh shoes,,https://www.taiwannews.com.tw/en/news/4326221,False,False,sports
45,"World no.2 squash player Ali Farag after winning the Optasia championships: ""all of a sudden we're allowed to speak politics in sports.. so i hope people look at oppression everywhere in the world.. which Palestinians have endured for the past 74 years.",,,False,True,sports
46,An actual seahawk lands on a Seahawks fan's head during the Rams/Seahawks game,,,False,True,sports
47,U.S. snowboarding champion Shaun White announces retirement,,https://www.nbcolympics.com/news/shaun-white-says-2022-olympics-will-be-his-final-competition,False,False,sports
48,Kareem Abdul-Jabbar Slams LeBron James for His 'Uninformed' COVID Meme: A 'Blow' to His 'Legacy',,https://people.com/sports/kareem-abdul-jabbar-slams-lebron-james-for-his-uninformed-covid-meme-a-blow-to-his-legacy/,False,False,sports
49,"Valieva listed 2 legal oxygen boosters on early Olympic forms, undercutting her 'took my grandfather's medicine by mistake' argument",,https://apnews.com/article/winter-olympics-figure-skating-kamila-valieva-sports-china-5b2ea37f6b4e086df8eba56691def75b,False,False,sports
50,[Highlights] LeBron James threw the ball at Scottie Barnes during their games vs Raptors.,,,False,True,sports
51,"Three years ago today, Kawhi Leonard hit the greatest shot in Raptors history",,,False,True,sports
52,China orders athlete to delete photos that showed flooding in Olympic Village,,https://www.yahoo.com/sports/winter-olympics-2022-china-orders-athlete-delete-photos-205502218-013229001.html,False,False,sports
53,"Unvaccinated NBA players who miss games will also be missing paychecks, league says",,https://www.nbcnews.com/news/us-news/unvaccinated-nba-players-who-miss-games-will-also-be-missing-n1280342,False,False,sports
54,Liverpool keeper Alisson mocking Everton keeper Pickford when the score is 2-0 after the latter wasted time at 0-0,,,False,True,sports
55,"Derek Poundstone breaks Axle Press World Record, decides to keep the weight up for a while just for fun",,,False,True,sports
56,110 m hurdler Grant Holloway funnily skips over the finish line in this 60 m race as by muscle memory he was expecting another obstacle. Birmingham 2022.,,,False,True,sports
57,Formula 1 cancel Russian Grand Prix,,,True,False,sports
58,"Poland, Czech Republic, and Sweden are refusing to play their 2022 World Cup qualifying matches in Russia after it attacked Ukraine",,https://www.businessinsider.com/countries-refuse-to-play-world-cup-qualifying-matches-russia-2022-2,False,False,sports
59,"In an already raucous atmosphere, Will Borland hits a 9 nine dart finish & blows the roof off the Alexandra Palace",,,False,True,sports
60,Ayumu Hirano wins the Gold Medal in the Men’s Snowboarding Halfpipe Finals on his last run,,,False,False,sports
61,"Emma Raducanu, ranked 150th in world, wins US Open; first qualifier in history to win a Grand Slam title",,https://www.theguardian.com/sport/live/2021/sep/11/emma-raducanu-leylah-fernandez-us-open-womens-tennis-final-live,False,False,sports
62,The 49ers upset the Packers after Robbie Gould's game winning field goal,,,False,True,sports
63,"15-seeded Saint Peter's defeats #3 seed Purdue, becomes the first 15-seed in NCAA Tournament history to reach the Elite 8",,,False,True,sports
64,NFL referee trips on a pylon while running down the sidelines during Tony Pollard's 100-yard kick return,,,False,True,sports
65,"World number 2 tennis player Medvedev calling the umpire's decision ""so stupid"" on live TV after being penalized with ""hindrance"" for saying ""sorry"" during the rally. It was so stupid that even his opponent was refusing the point awarded to him and would prefer to ""replay"" the point.",,,False,False,sports
66,Gretzky believes Russia should not be allowed to participate in World Juniors,,https://www.tsn.ca/video/~2391463,False,False,sports
67,Logan Paul v Floyd Mayweather ends in boos as each fighter makes millions,,https://www.theguardian.com/sport/2021/jun/07/logan-paul-vs-floyd-mayweather-boxing-fight-result-earnings,False,False,sports
68,Aaron Rodgers Rips Joe Biden And 'Fake White House' In Anti-Vax Rant - yahoo.com/Huffpost,,https://www.yahoo.com/entertainment/aaron-rodgers-rips-joe-biden-132210094.html,False,False,sports
69,"Michael Jordan giving his teammate the ""Is this guy for real?"" look before schooling him.",,,False,False,sports
70,Simone Biles reveals her aunt died unexpectedly during Tokyo Olympics,,https://www.cbsnews.com/news/simone-biles-olympics-aunt-dies/?ftag=CNM-00-10aab7e&linkId=126496085,False,False,sports
71,The Rams win 30–27 after Matthew Stafford's bomb to Kupp and a game winning field goal,,,False,True,sports
72,"Tom Brady throws a game-winning 58-yard touchdown pass in overtime to beat the Bills, and becomes the first player in NFL history to throw 700 touchdown passes",,,False,True,sports
73,"Rasheem Greene, a 279-pound defensive lineman for the Seattle Seahawks, returns a blocked extra point for an 80-yard defensive two-point conversion",,,False,False,sports
74,"Djokovic will be barred from attending Australian Open without vaccine, official says",,https://thehill.com/policy/healthcare/577741-djokovic-will-be-barred-from-attending-australian-open-without-vaccine?fbclid=IwAR2kmfGMPqk5hOhb035a_VWALm0Z5EV3ZEX3WZi-SNfGUFO7McOQURrRXOQ,False,False,sports
75,Raiders’ Carl Nassib comes out as gay; is first active NFL player to do so,,https://www.bostonglobe.com/2021/06/21/sports/raiders-carl-nassib-becomes-first-active-nfl-player-come-out-gay/,False,False,sports
76,Serbian volleyball player banned for ‘slant-eyed’ gesture,,https://www.scmp.com/sport/other-sport/article/3136664/serbian-volleyball-player-banned-slant-eyed-gesture-against,False,False,sports
77,Russian star Ovechkin makes plea: 'No more war',,https://www.espn.com/nhl/story/_/id/33370783/washington-capitals-alex-ovechkin-addresses-russia-invasion-ukraine-pleads-peace-no-more-war,False,False,sports
78,Chinese nationalists console themselves by including Taiwan's wins in fictitious medal table,,https://www.taiwannews.com.tw/en/news/4266780,False,False,sports
79,White Sox catcher takes pitch to the throat off the bounce,,,False,True,sports
80,"The Detroit Lions run a trick play, passing after a hand-off and reverse to a wide receiver, resulting in a long Kalif Raymond touchdown",,,False,False,sports
81,Rookie kicker Evan McPherson sends the Bengals to the AFC Conference Championship Game,,,False,True,sports
82,Michael Phelps Compares Trans Athletes in Women's Sports to Doping,,https://www.insider.com/michael-phelps-trans-athletes-womens-sports-doping-comparison-2022-1,False,False,sports
83,Belarus Olympian given Polish humanitarian visa after refusing 'forced' flight home for criticizing team officials,,https://www.bbc.com/news/world-europe-58052144,False,False,sports
84,Christian Eriksen scores his first goal since his cardiac arrest at Euro 2020,,,False,True,sports
85,My aunt has coached the same small town softball team for 40 years. Today they won the first state championship in the history of the town.,,,False,True,sports
86,A small moment of hilarity brought to you by the criminally slept on Sports Show with Norm Macdonald (2011),,,False,False,sports
87,"80-1 long shot Rich Strike, who had just entered the field Thursday, wins the Kentucky Derby!",,,False,True,sports
88,Steelers QB Ben Roethlisberger officially announces retirement after 18-year career,,https://sports.yahoo.com/nfl-ben-roethlisberger-officially-announces-retirement-after-18-year-career-with-steelers-152057735.html,False,False,sports
89,USA’s Erin Jackson becomes first Black woman to win Olympic speedskating gold,,https://www.theguardian.com/sport/2022/feb/13/usas-erin-jackson-speedskating-500m-gold-winter-olympics-2022-beijing,False,False,sports
90,MLB refutes Trump claim it invited him to World Series,,https://sports.yahoo.com/mlb-refutes-trump-claim-they-invited-him-to-world-series-200004450.html,False,False,sports
91,Rutgers Ron Harper Jr with the half-court shot on the buzzer to beat Perdue,,,False,True,sports
92,"According to French authorities, the woman that caused the crash in the Tour de France is in police custody",,https://www.rtl.fr/actu/justice-faits-divers/chute-dans-le-tour-de-france-la-spectatrice-responsable-placee-en-garde-a-vue-7900050886,False,False,sports
93,Ryan Crouser breaks the Outdoor Shot Put World Record with a throw of 23.37m(76’8 1/4”)!!!,,,False,True,sports
94,"Punter's kick is blocked, catches & runs it back for a Touchdown",,,False,False,sports
95,Peiman Maheripour lifts 492 kg/1085 lbs in preparation to take the World Record,,,False,True,sports
96,"Jorge Soler hits a home run on the first plate appearance of the 2021 World Series, becoming the first player to ever do so in the 117-year history of the World Series.",,,False,True,sports
97,"Tom Brady throws his 600th regular season touchdown pass, the first ever to do so in NFL history.",,,False,True,sports
98,Norway's Jakob Ingebrigtsen breaks the Olympic Record for the 1500 m run,,,False,True,sports
99,"Sumo Tournament Playoff between Veteran Takayasu and ""Young Boy"" Wakatakakage (for both the chance to win their first tournament)",,,False,True,sports
100,"Two hours before the men’s 100m competition, Paralympic Peter Genyn of Belgium found his wheelchair sabotaged by a competitor (3 flat tires and a broken frame). He used spare parts and duct-taped his frame together. He won Gold.",,https://www.paralympic.org/news/usa-and-tatyana-mcfaddden-take-historic-universal-relay-gold,False,False,sports
101,Jamaican bobsled teams qualify for 2022 Olympics,,https://twitter.com/TeamJA876/status/1483094900925251585?t=kTxF9kM491CaAKjZlcJkqA&s=09,False,False,sports
102,"Canada's Samantha Belliveau lifts the heaviest dumbbell ever lifted by a woman (183,4 lbs/83,1 kg)",,,False,True,sports
103,Simone Biles has been pulled from the remainder of the women's team finals,,https://www.espn.com/olympics/story/_/id/31890675/olympic-women-gymnastics-live-updates-simone-biles-team-usa-compete-team-finals,False,False,sports
104,"Novak Djokovic's visa cancelled, tennis player to be deported",,https://www.abc.net.au/news/2022-01-14/novak-djokovic-visa-cancellation-decision-immigration-minister/100748386,False,False,sports
105,Washington Football Team announces new name. The Washington Commanders,,https://www.nbcnews.com/news/amp/rcna14421,False,False,sports
106,Chris Barnett wallops Gian Villante with a spinning hook kick at UFC 268,,,False,True,sports
107,"97 yo Stanislavskyi who holds the Guinness World Records as the oldest itf tennis player in the world fulfills his dream, playing a round of tennis with Rafa Nadal in his academy",,,False,True,sports
108,Oklahoma Thunder’s SGA ties the game on a long 3 with 1.4 seconds remaining only for the Pelican’s Devonte Graham to hit a 3/4 court buzzer beater.,,,False,True,sports
109,NY Yankees will broadcast gun violence facts instead of their game w/ the TB Rays,,https://twitter.com/yankees/status/1529955869428965379?s=21&t=Wq5h2ynnxxDpLZt66fjyqg,False,False,sports
110,Olympics: Opening Ceremony rating hit all-time low,,https://sports.yahoo.com/olympics-opening-ceremony-draws-abysmal-ratings-why-arent-americans-tuning-in-011318548.html,False,False,sports
111,U.S. Soccer Agree to Guarantee Equal Pay Between Men's and Women's National Teams,,https://www.nytimes.com/2022/05/18/sports/soccer/us-soccer-equal-pay-deal.html,False,False,sports
112,Scorpion kick goal from Cyril Ngonge for Groningen vs AZ Alkmaar,,,False,True,sports
113,Antonio Brown waiting for a ride outside MetLife stadium after being released by the Buccaneers,,,True,False,sports
114,"High school teen wants Super Bowl to be on Saturday, nears 100,000 signatures",,https://www.floridatoday.com/story/sports/2022/01/18/frank-ruggeri-mission-convince-nfl-put-super-bowl-saturday/6557837001/,False,False,sports
115,Indian women cricketer Harleen Kaur's phenomenal catch against England,,,False,True,sports
116,Russian-licenced drivers banned from British motorsport,,https://www.motorsport.com/national/news/russian-drivers-banned-from-british-motorsport-by-motorsport-uk/8632678/,False,False,sports
117,Rams defensive tackle Aaron Donald choking a Packers offensive lineman,,https://gfycat.com/slighttenderarizonaalligatorlizard,False,False,sports
118,"Professional Disc Golfer, Ricky Wysocki, signs 4 year, $4,000,000 contract with Dynamic Discs. This is the 2nd disc golf contract valued at $1,000,000 per year.",,https://discgolf.ultiworld.com/2022/01/04/ricky-wysocki-signs-4-year-4-million-contract-with-dynamic-discs/,False,False,sports
119,"Oklahoma cornerback D.J. Graham makes a leaping, one-handed interception against Nebraska",,https://gfycat.com/secretrewardingamericangoldfinch,False,False,sports
120,Giannis Antetokounmpo bounced the ball 3 times from baseline to baseline and dunked,,https://gfycat.com/shrillbruisedhawk,False,False,sports
121,Djokovic has 80% stake in biotech firm developing Covid drug,,https://www.theguardian.com/sport/2022/jan/19/novak-djokovic-stake-biotech-firm-quantbiores-covid,False,False,sports
122,Rafael Nadal defeats Daniil Medvedev to win Australian Open for second time; sets new record with 21 Grand Slam men’s singles titles,,https://www.theguardian.com/sport/live/2022/jan/30/australian-open-mens-singles-final-rafael-nadal-v-daniil-medvedev-live,False,False,sports
123,Breaking: Dutch speed skater Ireen Wust wins the 1500m at the Olympics. Winning a gold medal in 5 consecutive Olympics also makes her the best Olympic speed skater in the history of the games.,,https://www.nytimes.com/2022/02/06/sports/olympics/ireen-wust-wins-speedskating-medals.html,False,False,sports
124,Canada’s Blayre Turnbull snapped her ankle celebrating after winning the Women’s Hockey World Championship. She returned on a stretcher to get her medal.,,,False,False,sports
125,The Michigan Wolverines defeat the Ohio State Buckeyes for the first time since 2011,,,False,True,sports
126,"Novak Djokovic denied entry to Australia, flying out later today",,https://www.theage.com.au/national/visa-bungle-delays-novak-djokovic-s-entry-into-australia-20220105-p59m75.html,False,False,sports
127,Autopsy: Severe brain trauma in ex-NFL player who shot 6,,https://apnews.com/article/nfl-sports-health-shootings-football-15b2c553682a7d122dbbc0d1eb76731c?utm_campaign=SocialFlow&utm_medium=AP&utm_source=Twitter,False,False,sports
128,Celtics star Jayson Tatum hits a spinning layup to win Game 1 against the Nets,,,False,True,sports
129,19 year old Carlos Alcaraz's match point to beat Rafa Nadal on clay,,,False,True,sports
130,Stephen Curry breaks Ray Allen's record for the most three-pointers made in NBA history,,,False,True,sports
131,Logan Martin lands a front bike flip in Olympic competition,,,False,True,sports
132,Top boxer Vasiliy Lomachenko joins territorial defense battalion in Ukraine,,https://www.espn.com/boxing/story/_/id/33388013/top-boxer-vasiliy-lomachenko-joins-terror-defense-battalion-ukraine,False,False,sports
133,Odell Beckham Jr. Will Receive 100 Percent of His 2021-22 Rams Contract in Bitcoin via cash app,,https://amp.www.complex.com/sports/odell-beckham-will-receive-rams-contract-in-bitcoin,False,False,sports
134,New Orleans Pelicans forward Brandon Ingram picks up the loose ball and makes a no-look halfcourt shot to beat the halftime buzzer,,,False,True,sports
135,Tyson Fury finishes off Dillan Whyte in the sixth round at Wembley.,,,False,False,sports
136,Argentina win the Copa America. This is Messi’s first major international trophy.,,,True,False,sports
137,Rafael Nadal Defeats Novak Djokovic In Four-Set Thriller In French Open Quarterfinal,,https://lastwordonsports.com/tennis/2022/05/31/rafael-nadal-defeats-novak-djokovic-french-open-quarterfinal/,False,False,sports
138,Charles Leclerc saves his Ferrari,,,False,False,sports
139,Hafthor Bjornsson (The Mountain) blasting Eddie Hall with a left cross.,,,False,True,sports
140,Kapler won't take field during anthem in protest: San Francisco Giants manager Gabe Kapler 'not okay with the state of this country' in wake of Uvalde shooting,,https://www.espn.com/mlb/story/_/id/33994591/san-francisco-giants-manager-gabe-kapler-not-okay-state-country-wake-uvalde-shooting,False,False,sports
141,"NFL fines Packers $300K, Aaron Rodgers $15K for COVID-19 protocol violations",,https://www.yahoo.com/sports/nfl-fines-packers-300-k-aaron-rodgers-15-k-covid-19-protocol-violations-013816178.html,False,False,sports
142,[FC Barcelona] Lionel Messi will leave the club,,https://twitter.com/fcbarcelona_es/status/1423339729811030019?s=21,False,False,sports
143,Mateusz Kieliszkowski breaks World Record in 100 m rowing in his first attempt,,,False,True,sports
144,Japan says it will not send government delegation to Beijing Olympics,,https://www.nbcnews.com/news/world/japan-says-will-not-send-government-delegation-beijing-olympics-rcna9890,False,False,sports
145,"The Kansas Jayhawks, a 31-point road underdog that hadn't won a road conference game since 2008, go for 2 in overtime and beat Texas",,,False,True,sports
146,Bubba Wallace becomes 2nd Black driver to win NASCAR Cup race.,,https://www.espn.com/racing/nascar/cup/story/_/id/32339189/bubba-wallace-becomes-2nd-black-driver-win-nascar-cup-race,False,False,sports
147,Spectator causes mass crash at the first stage of the Tour de France.,,https://streamable.com/gzizvc,False,False,sports
148,Georgia freshman Kelee Ringo pick sixes Bryce Young to all but clinch the the first National Title for the Bulldogs since 1980,,,False,True,sports
149,Abdi Nageeye pushes his best friend Bashir Abdi during the Olympic marathon to join him for a medal. Two somali born athletes with this unprecedented achievement 🇸🇴,,,False,True,sports
150,International handball is changing its dress code after a women's team was fined for wearing shorts instead of bikini bottoms ​​,,https://www.insider.com/handball-changing-women-dress-code-after-norway-fined-wearing-shorts-2021-11,False,False,sports
151,"Snowboarders fed up with judging at Beijing Olympics, cite inconsistent scoring in slopestyle, halfpipe and big air",,https://www.espn.com/olympics/story/_/id/33287870/snowboarders-fed-judging-beijing-olympics-cite-inconsistent-scoring-slopestyle-halfpipe-big-air,False,False,sports
152,John Stockton claims to have list of hundreds of vaccinated athletes who have dropped dead on the field,,https://www.yahoo.com/sports/john-stockton-claims-list-hundreds-200913392.html,False,False,sports
153,"After Nathan Chen Performed To ‘Rocket Man’ And Won Gold, Of Course, Elton John Sent His Congrats",,https://www.cinemablend.com/television/after-nathan-chen-performed-to-rocket-man-and-won-gold-of-course-elton-john-sent-his-congrats,False,False,sports
154,Charles Barkley plays goalie against Wayne Gretzky,,,False,True,sports
